医院名,院長名
郡山ラポール歯科,不明
酒井歯科医院,酒井直樹
石岡矯正歯科・小児歯科 茨城診療所,仮谷太良
ながしま•おとなこども•シニア歯科,長島正尚
つくばリボン歯科・矯正歯科 インプラント,不明
シナジー歯科｜つくばの歯医者,片口卓
ウララ歯科クリニック,不明
いわいグリーン歯科・矯正歯科,坂本健二郎
荒井矯正歯科クリニック,荒井宏之
つくばホワイト歯科・矯正歯科,千葉真紀子
つくば松代歯科・口腔外科・矯正歯科・小児歯科,徳山権一
アントラーズオーラルケアクリニック|つくば歯医者・矯正歯科・ホワイトニング,山本千博
イクシーファミリー口腔歯科・小児歯科・矯正歯科,安部秀弘
おかもとこどもおとな歯科,岡本愛実
足利おとなこども歯科・矯正歯科,不明
おとなとこどもの歯医者さん 小野歯科,不明
ココ歯科クリニック,加藤淳
長谷川みらい歯科・矯正歯科,長谷川雄一
畠山医科歯科クリニック,不明
宇都宮矯正歯科,不明
くにい歯科・矯正歯科,不明
むらかみ歯科・矯正歯科,不明
宇津矯正歯科医院,不明
矯正歯科ポリリン酸ホワイトニング,不明
宇都宮歯科,不明
なかの歯科・矯正歯科クリニック／なかの KIDS デンタル,不明
歯科あべクリニック 矯正歯科 小児歯科 口腔外科,不明
高崎おとなこども歯科・矯正歯科 高崎オーパ院,不明
エース歯科,不明
長島歯科・矯正歯科,不明
尾島デンタルクリニック,不明
医療法人なかじま歯科クリニック,不明
まつい歯科クリニック北高崎,不明
野中歯科・矯正歯科,不明
前橋かんだ歯科・矯正歯科,不明
さいたま・こども矯正歯科,不明
川口おとなこども歯科 ママとこどものはいしゃさんアリオ川口院,不明
しらこばと歯科,不明
ニコデンタルクリニック,不明
LeaLea歯科・矯正歯科クリニック,不明
イクティス歯科クリニック,不明
関口デンタルオフィス埼玉,不明
オレンジ歯科 西武所沢店,不明
大宮駅前矯正歯科クリニック,不明
大宮歯科・矯正歯科,不明
浦和もちまる歯科・矯正歯科クリニック,不明
蕨歯科・矯正歯科,不明
武蔵浦和歯科・矯正歯科,不明
川口リボンシティ歯科・矯正歯科 インプラント,不明
飯能矯正歯科クリニック,不明
大宮SHIN矯正歯科,不明
ファミリア歯科矯正,不明
大宮リボン歯科・矯正歯科 インプラント,不明
マロニエ矯正歯科クリニック,不明
デンタルヘルスケア矯正歯科 浦和,不明
志木駅前歯科・矯正歯科,不明
千葉こどもの歯医者さん,不明
船橋こども歯科,不明
パール小児歯科医院,不明
津田沼こども歯科・ おとなこども矯正歯科,不明
あい歯科 矯正・こども歯科,不明
浦安デンタルクリニック,不明
ふなばしキッズデンタル,不明
柏 なかよし矯正歯科・小児歯科 医療法人社団カムイ会,不明
千葉センシティ矯正歯科,不明
まきの歯列矯正クリニック,不明
西千葉歯科・矯正歯科,不明
もりざわ歯科・矯正歯科,不明
船橋リボン歯科・矯正歯科 インプラント,不明
市川駅前矯正歯科,不明
秋山矯正歯科,不明
新浦安駅前矯正歯科,不明
幕張歯科・矯正歯科,不明
市川真間こずえ歯科・矯正歯科,不明
矯正歯科クリニック柏の葉,不明
千葉みなと歯科・矯正歯科,不明
都筑キッズデンタルランド,不明
はなここども歯科クリニック|川崎市 小児歯科,不明
はる小児歯科・矯正歯科クリニック,不明
希望ヶ丘ファミリー歯科＆こどものための歯科医院,不明
リーフおとなこども歯科,不明
ポーラスター矯正歯科・小児歯科 たまプラーザ,不明
スマイル10 こども歯科・矯正歯科,不明
鶴見豊岡こどもおとな歯科,不明
登戸＠歯科,不明
ニコデンタルクリニック戸塚歯科,不明
長津田矯正歯科クリニック,不明
ひろ矯正歯科クリニック,不明
溝の口佐和歯科・矯正歯科・口腔外科,不明
医療法人社団緑幸会 登戸グリーン歯科・矯正歯科,不明
生田駅前歯科・矯正歯科,不明
ポーラスター矯正歯科センター北（こうざき歯列矯正クリニック）,不明
元住吉歯科・矯正歯科,不明
ALBA歯科&矯正歯科 武蔵小杉院,不明
鷺沼デンタルクリニック・矯正歯科,不明
ALBA歯科＆矯正歯科 登戸院,不明
いしかわこどもファミリー歯科,不明
宮尾歯科クリニック,不明
新潟矯正歯科クリニック,不明
新潟I'S歯科・矯正歯科,不明
ホワイトベリー万代デンタルクリニック,不明
まつみだい歯科診療所,不明
ホワイトベリー歯科医院,不明
やまざき歯科医院,不明
とやま総合歯科・矯正歯科クリニック,不明
富山石金歯科,不明
坂東矯正歯科,不明
