url,title,tags,channel_url,channel_id
https://www.youtube.com/watch?v=aoX_pGQMbEM,"AI Agents can write 10,000 lines of hacking code in seconds [Dr. Ilia Shumailov]",AIエージェント,https://www.youtube.com/channel/UCMLtBahI5DMrt0NPvDSoIRQ,UCMLtBahI5DMrt0NPvDSoIRQ
https://www.youtube.com/watch?v=HCh3nOLuUCA,AI Agents for Visual Inspection in Manufacturing,AIエージェント,https://www.youtube.com/channel/UCHuiy8bXnmK5nisYHUd1J5g,UCHuiy8bXnmK5nisYHUd1J5g
https://www.youtube.com/watch?v=t_zeCzH7u1w,"AI Agents, Mega Rounds, and 2026 Predictions | Equity Podcast",AIエージェント,https://www.youtube.com/channel/UCCjyq_K1Xwfg8Lndy7lKMpA,UCCjyq_K1Xwfg8Lndy7lKMpA
https://www.youtube.com/watch?v=9-6LtfjYmpg,AI Agents: No Code vs Code Frameworks - Which one is right for you?,AIエージェント,https://www.youtube.com/channel/UCh9nVJoWXmFb7sLApWGcLPQ,UCh9nVJoWXmFb7sLApWGcLPQ
https://www.youtube.com/watch?v=XrYwFUdu2lk,"AI Dev 25 x NYC | Christoph Meyer, Lars Heling: Improving AI Agent Discovery with a Knowledge Graph",AIエージェント,https://www.youtube.com/channel/UCcIXc5mJsHVYTZR1maL5l9w,UCcIXc5mJsHVYTZR1maL5l9w
https://www.youtube.com/watch?v=K_GD2Y0O4JM,AI Dev 25 x NYC | David Park: Impact of Agentic AI in Financial Services on Document Extraction,AIエージェント,https://www.youtube.com/channel/UCcIXc5mJsHVYTZR1maL5l9w,UCcIXc5mJsHVYTZR1maL5l9w
https://www.youtube.com/watch?v=8tg8z-Fi0MU,"AI Dev 25 x NYC | Tanveer Mittal, Utkarsh Lamba: Building with the Claude Agent SDK",AIエージェント,https://www.youtube.com/channel/UCcIXc5mJsHVYTZR1maL5l9w,UCcIXc5mJsHVYTZR1maL5l9w
https://www.youtube.com/watch?v=fGSpr8bHxcM,AI Dev 25 x NYC | Tyler Slaton: Build User Facing Agentic Applications with AG UI,AIエージェント,https://www.youtube.com/channel/UCcIXc5mJsHVYTZR1maL5l9w,UCcIXc5mJsHVYTZR1maL5l9w
https://www.youtube.com/watch?v=1HHZdB2O2tI,"AI Is CHANGING EVERYTHING: Veo 3.1, ChatGPT Checkout & The Agentic Era",AIエージェント,https://www.youtube.com/channel/UCOFl0wDeBMSBbK3jNJQHHFg,UCOFl0wDeBMSBbK3jNJQHHFg
https://www.youtube.com/watch?v=z7YsP05thd0,"AI JUST LEVELED UP: ChatGPT Agents, Robots & China’s Power Move",AIエージェント,https://www.youtube.com/channel/UCOFl0wDeBMSBbK3jNJQHHFg,UCOFl0wDeBMSBbK3jNJQHHFg
https://www.youtube.com/watch?v=BCW-wrDzWCs,AI NEWS: Can ChatGPT's Agent Do Everything For You Now?,AIエージェント,https://www.youtube.com/channel/UChpleBmo18P08aKCIgti38g,UChpleBmo18P08aKCIgti38g
https://www.youtube.com/watch?v=lglldcu24ok,"AI Round-up: Karpathy Reactions, OpenAI’s Dealmaking, & Bubble Reality Check",Operator/ブラウザ自動化,https://www.youtube.com/channel/UCUl-s_Vp-Kkk_XVyDylNwLA,UCUl-s_Vp-Kkk_XVyDylNwLA
https://www.youtube.com/watch?v=zt0JA5rxdfM,"AI Trends 2026: Quantum, Agentic AI & Smarter Automation",AIエージェント,https://www.youtube.com/channel/UCKWaEZ-_VweaEx1j62do_vQ,UCKWaEZ-_VweaEx1j62do_vQ
https://www.youtube.com/watch?v=S6wc6yvoZLY,AI agents are paying each other now…,AIエージェント,https://www.youtube.com/channel/UCsBjURrPoezykLs9EqgamOA,UCsBjURrPoezykLs9EqgamOA
https://www.youtube.com/watch?v=SdNRWJ-oqjY,AI agents in 2025: Why agentic commerce isn't ready for Black Friday yet,AIエージェント,https://www.youtube.com/channel/UCKWaEZ-_VweaEx1j62do_vQ,UCKWaEZ-_VweaEx1j62do_vQ
https://www.youtube.com/watch?v=l93vxp-jcvY,AI agents: The future of secure code,AIエージェント,https://www.youtube.com/channel/UCHFEou9pndBIAW5NA200TAQ,UCHFEou9pndBIAW5NA200TAQ
https://www.youtube.com/watch?v=HXy3J1mGHRE,AI and automation expert on how leaders use AI agents to get ahead | Pascal Bornet,AIエージェント,https://www.youtube.com/channel/UCFtEEv80fQVKkD4h1PF-Xqw,UCFtEEv80fQVKkD4h1PF-Xqw
https://www.youtube.com/watch?v=ITyxrAdt4Gs,AI エージェントによる臨床研究と商業化の加速,AIエージェント,https://www.youtube.com/channel/UCtpJJpXnmHgI6ecoz-KyB5w,UCtpJJpXnmHgI6ecoz-KyB5w
https://www.youtube.com/watch?v=GJpfVaRaPNY,AI エージェントの可能性を最大限に引き出す AI-Q NVIDIA Blueprint,AIエージェント,https://www.youtube.com/channel/UCtpJJpXnmHgI6ecoz-KyB5w,UCtpJJpXnmHgI6ecoz-KyB5w
https://www.youtube.com/watch?v=w5xtbdoPfTg,AI-Driven Collaboration with Notion's Ryan Nystrom | Exploring Notion 3.0 and Custom AI Agents,AIエージェント,https://www.youtube.com/channel/UCHFEou9pndBIAW5NA200TAQ,UCHFEou9pndBIAW5NA200TAQ
https://www.youtube.com/watch?v=aPXJLb6-uxM,AIは既に次のフェーズへ！AIベンチマーク開発者の講演から《知能の仕組み》を紐解き、「エージェントの時代」から「イノベーターの時代」への移行の真価を理解した一週間（2025年7月12日配信版_後編）,AIエージェント,https://www.youtube.com/channel/UCtugWOg4u2SyuenPfeO1xYQ,UCtugWOg4u2SyuenPfeO1xYQ
https://www.youtube.com/watch?v=eVXMETKLqxw,AIエージェントとは何かがスッキリ分かる動画【仕組みも解説】,AIエージェント,https://www.youtube.com/channel/UC9AuyS7U4PxeDSNMJ2srarA,UC9AuyS7U4PxeDSNMJ2srarA
https://www.youtube.com/watch?v=SsjV88U84uo,AIエージェントに必要？ClaudeのThink Toolが良さそうだったので解説してみた,AIエージェント,https://www.youtube.com/channel/UCZQVTC3uLCyuJUOcRlguazA,UCZQVTC3uLCyuJUOcRlguazA
https://www.youtube.com/watch?v=4eSfT8QuYFc,AIエージェントの力を解き放つ：CACEISがVAST DataとNVIDIAとともに、顧客との対話を再定義,AIエージェント,https://www.youtube.com/channel/UCtpJJpXnmHgI6ecoz-KyB5w,UCtpJJpXnmHgI6ecoz-KyB5w
https://www.youtube.com/watch?v=ZLW87bBYeJE,AIエージェント新時代の到来？「学ぶ」を変えるMicrosoft Amplifierとは｜伊藤穰一,AIエージェント,https://www.youtube.com/channel/UCdpNM_rxeWmHuzqoVDgBayw,UCdpNM_rxeWmHuzqoVDgBayw
https://www.youtube.com/watch?v=847eGg-X7Us,AIエージェント時代に活躍する7つの習慣～どのようにAIに向き合うべきか？について、いけともの経験から徹底解説,AIエージェント,https://www.youtube.com/channel/UCpUQnk6MaY4o3NdgJmv10cw,UCpUQnk6MaY4o3NdgJmv10cw
https://www.youtube.com/watch?v=pablEq295Wc,AWS needs you to believe in AI agents | Equity Podcast,AIエージェント,https://www.youtube.com/channel/UCCjyq_K1Xwfg8Lndy7lKMpA,UCCjyq_K1Xwfg8Lndy7lKMpA
https://www.youtube.com/watch?v=P4VFL9nIaIA,Agent Development Kit (ADK) Masterclass: Build AI Agents & Automate Workflows (Beginner to Pro),AIエージェント,https://www.youtube.com/channel/UCEzrs7gK6Nf6t_tadEprzxQ,UCEzrs7gK6Nf6t_tadEprzxQ
https://www.youtube.com/watch?v=AF5BBIj3N-Q,Agent Handoffs | OpenAI Agent SDK with Typescript,AIエージェント,https://www.youtube.com/channel/UCf9T51_FmMlfhiGpoes0yFA,UCf9T51_FmMlfhiGpoes0yFA
https://www.youtube.com/watch?v=FqF4b7Uemfc,Agentic AI & LLMs Power Real‑Time Insights at Wimbledon & US Open,AIエージェント,https://www.youtube.com/channel/UCKWaEZ-_VweaEx1j62do_vQ,UCKWaEZ-_VweaEx1j62do_vQ
https://www.youtube.com/watch?v=l5GLvMlfIyg,Agentic AI Bootcamp With No Code Tools n8n Udemy Course Announcement,AIエージェント,https://www.youtube.com/channel/UCNU_lfiiWBdtULKOw6X0Dig,UCNU_lfiiWBdtULKOw6X0Dig
https://www.youtube.com/watch?v=IaJ2jXmljmM,Agentic AI Meets Shadow AI : Zero Trust Security for AI Automation,AIエージェント,https://www.youtube.com/channel/UCKWaEZ-_VweaEx1j62do_vQ,UCKWaEZ-_VweaEx1j62do_vQ
https://www.youtube.com/watch?v=SP-b_G74Nuk,Agentic AI Project in LangGraph | Build Lovable Clone,AIエージェント,https://www.youtube.com/channel/UCh9nVJoWXmFb7sLApWGcLPQ,UCh9nVJoWXmFb7sLApWGcLPQ
https://www.youtube.com/watch?v=DNBaUCCST3I,Agentic AI Roadmap 2025,AIエージェント,https://www.youtube.com/channel/UCh9nVJoWXmFb7sLApWGcLPQ,UCh9nVJoWXmFb7sLApWGcLPQ
https://www.youtube.com/watch?v=CnXdddeZ4tQ,Agentic AI Tutorial for Beginners | Langgraph Tutorial,AIエージェント,https://www.youtube.com/channel/UCh9nVJoWXmFb7sLApWGcLPQ,UCh9nVJoWXmFb7sLApWGcLPQ
https://www.youtube.com/watch?v=yDpV_jgO93c,Agentic AI With Autogen Crash Course Ft: @tech.mayankagg,AIエージェント,https://www.youtube.com/channel/UCNU_lfiiWBdtULKOw6X0Dig,UCNU_lfiiWBdtULKOw6X0Dig
https://www.youtube.com/watch?v=mlLdzM2Xp08,Agentic Behavior & Multi-Agent Basics | Multi Agent Workflows for Beginners | Part 1,AIエージェント,https://www.youtube.com/channel/UCzL_0nIe8B4-7ShhVPfJkgw,UCzL_0nIe8B4-7ShhVPfJkgw
https://www.youtube.com/watch?v=5TBsXGdmkc0,Agentic With LangGraph Crash Course-Part 2- Debugging And Monitering,AIエージェント,https://www.youtube.com/channel/UCNU_lfiiWBdtULKOw6X0Dig,UCNU_lfiiWBdtULKOw6X0Dig
https://www.youtube.com/watch?v=cTBGIKAckKE,"Amazon Bedrock AgentCore Tutorial | Build, Deploy, Operate AI Agents using AgentCore",AIエージェント,https://www.youtube.com/channel/UCh9nVJoWXmFb7sLApWGcLPQ,UCh9nVJoWXmFb7sLApWGcLPQ
https://www.youtube.com/watch?v=wXujj978x6o,"An AI agent can continue developing autonomously for ""several days""?! Claude explains the new mec...",AIエージェント,https://www.youtube.com/channel/UCvHpETRVi1tXeRJoYiXHJqw,UCvHpETRVi1tXeRJoYiXHJqw
https://www.youtube.com/watch?v=X5z1ZaEaJjU,Anatomy of an Agent: Anthropic’s Claude 4 and Enterprise-Grade Autonomy | VB Transform 2025,AIエージェント,https://www.youtube.com/channel/UCHFEou9pndBIAW5NA200TAQ,UCHFEou9pndBIAW5NA200TAQ
https://www.youtube.com/watch?v=iaZS1jer8MY,Android malware that acts like a person and AI agents that act like malware,AIエージェント,https://www.youtube.com/channel/UCKWaEZ-_VweaEx1j62do_vQ,UCKWaEZ-_VweaEx1j62do_vQ
https://www.youtube.com/watch?v=sVXOYsgIig8,Ansh Kanwar and Shon Burton on the Future of AI Agents,AIエージェント,https://www.youtube.com/channel/UCckOvibZFUOMpBZd2FDKhnw,UCckOvibZFUOMpBZd2FDKhnw
https://www.youtube.com/watch?v=JdT78t1Offo,"Anthropic Co-founder: Building Claude Code, Lessons From GPT-3 & LLM System Design",起業/新規事業,https://www.youtube.com/channel/UCcefcZRL2oaA_uBNeo5UOWg,UCcefcZRL2oaA_uBNeo5UOWg
https://www.youtube.com/watch?v=cCAdoswM8WM,Anthropic founder warns the world of what's coming...,起業/新規事業,https://www.youtube.com/channel/UCawZsQWqfGSbCI5yjkdVkTA,UCawZsQWqfGSbCI5yjkdVkTA
https://www.youtube.com/watch?v=EcwsvwVJnY4,Anthropic's co-founder is throwing up MASSIVE red flags...,起業/新規事業,https://www.youtube.com/channel/UCqcbQf6yw5KzRoDDcZ_wBSw,UCqcbQf6yw5KzRoDDcZ_wBSw
https://www.youtube.com/watch?v=nItsfXwujjg,Anthropic’s NEW Claude Code Review Agent (Full Open Source Workflow),AIエージェント,https://www.youtube.com/channel/UCEMA_xj3YeAI7Z6jsOw3peg,UCEMA_xj3YeAI7Z6jsOw3peg
https://www.youtube.com/watch?v=2jOnoTEk-xA,Aravind Srinivas: Perplexity's Race to Build Agentic Search,AIエージェント,https://www.youtube.com/channel/UCcefcZRL2oaA_uBNeo5UOWg,UCcefcZRL2oaA_uBNeo5UOWg
https://www.youtube.com/watch?v=2HVFruvFf08,Are you ready for AI agents?,AIエージェント,https://www.youtube.com/channel/UCHFEou9pndBIAW5NA200TAQ,UCHFEou9pndBIAW5NA200TAQ
https://www.youtube.com/watch?v=TiN_QaEfCYc,Atlas Browser by ChatGPT: The Smartest (and Creepiest?) Browser Yet,Operator/ブラウザ自動化,https://www.youtube.com/channel/UCCKx8mAHiFus-XYQLy_WnaA,UCCKx8mAHiFus-XYQLy_WnaA
https://www.youtube.com/watch?v=8NKhyaBpfIU,Automate Tasks with Pre-Built AI Agents | n8n Tutorial 🔥,AIエージェント,https://www.youtube.com/channel/UCeVMnSShP_Iviwkknt83cww,UCeVMnSShP_Iviwkknt83cww
https://www.youtube.com/watch?v=5jwiwaPyZCE,Automating knowledge work with AI agents - LlamaIndex @ Fully Connected London '25,AIエージェント,https://www.youtube.com/channel/UCBp3w4DCEC64FZr4k9ROxig,UCBp3w4DCEC64FZr4k9ROxig
https://www.youtube.com/watch?v=6sSPFNrDFMI,Automation without coding! Create commands incorporating Skills/Subagents with Claude Code Workfl...,AIエージェント,https://www.youtube.com/channel/UCvHpETRVi1tXeRJoYiXHJqw,UCvHpETRVi1tXeRJoYiXHJqw
https://www.youtube.com/watch?v=ESIL0Rzl5VQ,Autoscaling your AI agent under load,AIエージェント,https://www.youtube.com/channel/UCJS9pqu9BzkAMNTmzNMNhvg,UCJS9pqu9BzkAMNTmzNMNhvg
https://www.youtube.com/watch?v=8_liatgLkLc,Avoid Messy Code: Design Patterns for AI Agents in Python,AIエージェント,https://www.youtube.com/channel/UCVhQ2NnY5Rskt6UjCUkJ_DA,UCVhQ2NnY5Rskt6UjCUkJ_DA
https://www.youtube.com/watch?v=HFEwfd7OMLQ,Best AI Agent Frameworks & Dev Kits [2025] – Top 7 Ranked,AIエージェント,https://www.youtube.com/channel/UCGdOo5ARCSpxFQ-ssIsgi4Q,UCGdOo5ARCSpxFQ-ssIsgi4Q
https://www.youtube.com/watch?v=Wr0AsdR-I3k,Best Agentic AI Framework,AIエージェント,https://www.youtube.com/channel/UCh9nVJoWXmFb7sLApWGcLPQ,UCh9nVJoWXmFb7sLApWGcLPQ
https://www.youtube.com/watch?v=824Fyh146_w,Better than Cursor? Future Agentic Coding available today,AIエージェント,https://www.youtube.com/channel/UCrXSVX9a1mj8l0CMLwKgMVw,UCrXSVX9a1mj8l0CMLwKgMVw
https://www.youtube.com/watch?v=UuMznUFQflo,Bioshok explains the difference between AI and AGI: AI will increase economic growth by 10 to 20 ...,AGI/ロードマップ,https://www.youtube.com/channel/UCKaQevFzchUw5TzqjL_tBRQ,UCKaQevFzchUw5TzqjL_tBRQ
https://www.youtube.com/watch?v=eSbeub2ZeNk,Build & Deploy a Python AI Agent in 20 Minutes,AIエージェント,https://www.youtube.com/channel/UC4JX40jDee_tINbkjycV4Sg,UC4JX40jDee_tINbkjycV4Sg
https://www.youtube.com/watch?v=ni8Xl0ANx0E,Build ANY AI Agent with this Context Engineering Blueprint,AIエージェント,https://www.youtube.com/channel/UCMwVTLZIRRUyyVrkjDpn4pA,UCMwVTLZIRRUyyVrkjDpn4pA
https://www.youtube.com/watch?v=tFFKuq2t0rI,Build ANYTHING with Base44 and n8n AI Agents (beginner's guide),AIエージェント,https://www.youtube.com/channel/UC2ojq-nuP8ceeHqiroeKhBA,UC2ojq-nuP8ceeHqiroeKhBA
https://www.youtube.com/watch?v=X80ljdCPM_U,Build ANYTHING with Claude Sonnet 4.5 and n8n AI Agents,AIエージェント,https://www.youtube.com/channel/UC2ojq-nuP8ceeHqiroeKhBA,UC2ojq-nuP8ceeHqiroeKhBA
https://www.youtube.com/watch?v=Vb1SwBAn9cQ,Build ANYTHING with Gemini 3 Pro and n8n AI Agents,AIエージェント,https://www.youtube.com/channel/UC2ojq-nuP8ceeHqiroeKhBA,UC2ojq-nuP8ceeHqiroeKhBA
https://www.youtube.com/watch?v=hj0nTLbhIEY,Build ANYTHING with Gemini 3 | The Agent Factory Podcast,AIエージェント,https://www.youtube.com/channel/UCJS9pqu9BzkAMNTmzNMNhvg,UCJS9pqu9BzkAMNTmzNMNhvg
https://www.youtube.com/watch?v=gGCwSIlIRlY,Build Anything with GPT-5 and n8n AI Agents,AIエージェント,https://www.youtube.com/channel/UC2ojq-nuP8ceeHqiroeKhBA,UC2ojq-nuP8ceeHqiroeKhBA
https://www.youtube.com/watch?v=VKAq_PA_21U,Build MCP business for vibe coder,フレームワーク,https://www.youtube.com/channel/UCrXSVX9a1mj8l0CMLwKgMVw,UCrXSVX9a1mj8l0CMLwKgMVw
https://www.youtube.com/watch?v=8jfcloETVVI,Build Multiple Projects in Parallel with This Agentic AI Tool 🔥,AIエージェント,https://www.youtube.com/channel/UCeVMnSShP_Iviwkknt83cww,UCeVMnSShP_Iviwkknt83cww
https://www.youtube.com/watch?v=BMt-qvrEcFY,Build Serverless AI Agents with Langbase,AIエージェント,https://www.youtube.com/channel/UC8butISFwT-Wl7EV0hUK0BQ,UC8butISFwT-Wl7EV0hUK0BQ
https://www.youtube.com/watch?v=Jekzc6BM5_w,Build Your First AI Agent in 20 Minutes (No Coding Required),AIエージェント,https://www.youtube.com/channel/UCh9nVJoWXmFb7sLApWGcLPQ,UCh9nVJoWXmFb7sLApWGcLPQ
https://www.youtube.com/watch?v=TXVyxJdlzQs,Build Your First Voice AI Agent in 20 Minutes with LiveKit (Open Source),AIエージェント,https://www.youtube.com/channel/UCMwVTLZIRRUyyVrkjDpn4pA,UCMwVTLZIRRUyyVrkjDpn4pA
https://www.youtube.com/watch?v=gaGaPpnexxA,Build a Python AI Agent in 10 Minutes,AIエージェント,https://www.youtube.com/channel/UC4JX40jDee_tINbkjycV4Sg,UC4JX40jDee_tINbkjycV4Sg
https://www.youtube.com/watch?v=9i3ic1sVhlI,Build an AI Army With Claude Code’s New Sub-Agents,AIエージェント,https://www.youtube.com/channel/UCMcoud_ZW7cfxeIugBflSBw,UCMcoud_ZW7cfxeIugBflSBw
https://www.youtube.com/watch?v=q4YnO0MBaeI,Build reliable AI agents using W&B Training,AIエージェント,https://www.youtube.com/channel/UCBp3w4DCEC64FZr4k9ROxig,UCBp3w4DCEC64FZr4k9ROxig
https://www.youtube.com/watch?v=ZkYxLIsqJoo,Build your own AI Agent with OpenAI Agent Builder,AIエージェント,https://www.youtube.com/channel/UCwSozl89jl2zUDzQ4jGJD3g,UCwSozl89jl2zUDzQ4jGJD3g
https://www.youtube.com/watch?v=JXJJ34loId8,Building AI & Agentic Workflows with Inngest Backend and Next.js,AIエージェント,https://www.youtube.com/channel/UCf9T51_FmMlfhiGpoes0yFA,UCf9T51_FmMlfhiGpoes0yFA
https://www.youtube.com/watch?v=Wg8ue17LMT8,Building AI Agents & Agentic AI System via Microsoft AutoGen Udemy Course Is Live!!,AIエージェント,https://www.youtube.com/channel/UCNU_lfiiWBdtULKOw6X0Dig,UCNU_lfiiWBdtULKOw6X0Dig
https://www.youtube.com/watch?v=hwWGx91hwY0,Building Production-Ready AI Agents with Strands Agents — Du’An Lightfoot (AWS),AIエージェント,https://www.youtube.com/channel/UCckOvibZFUOMpBZd2FDKhnw,UCckOvibZFUOMpBZd2FDKhnw
https://www.youtube.com/watch?v=BJpBp2gwk2Y,Building Smart Cities With Digital Twins and Agentic AI,AIエージェント,https://www.youtube.com/channel/UCHuiy8bXnmK5nisYHUd1J5g,UCHuiy8bXnmK5nisYHUd1J5g
https://www.youtube.com/watch?v=tRGoT1QV8VA,Building agentic AI workflows with W&B Weave: a hiring assistant case study,AIエージェント,https://www.youtube.com/channel/UCBp3w4DCEC64FZr4k9ROxig,UCBp3w4DCEC64FZr4k9ROxig
https://www.youtube.com/watch?v=uhJJgc-0iTQ,Building more effective AI agents,AIエージェント,https://www.youtube.com/channel/UCrDwWp7EBBv4NwvScIpBDOA,UCrDwWp7EBBv4NwvScIpBDOA
https://www.youtube.com/watch?v=d-l0SH8PYqM,Building observable AI agent ecosystems in the $1 trillion post-SaaS economy | VB Transform 2025,AIエージェント,https://www.youtube.com/channel/UCHFEou9pndBIAW5NA200TAQ,UCHFEou9pndBIAW5NA200TAQ
https://www.youtube.com/watch?v=CCV5fKgmdQc,Building our first AI Agent - Hello World | OpenAI Agent SDK with Typescript,AIエージェント,https://www.youtube.com/channel/UCf9T51_FmMlfhiGpoes0yFA,UCf9T51_FmMlfhiGpoes0yFA
https://www.youtube.com/watch?v=XuvKFsktX0Q,Building the future of agents with Claude,AIエージェント,https://www.youtube.com/channel/UCrDwWp7EBBv4NwvScIpBDOA,UCrDwWp7EBBv4NwvScIpBDOA
https://www.youtube.com/watch?v=JKW8InX3mdQ,"Building with Gemini 3, AI Studio, Antigravity, and Nano Banana | The Agent Factory Podcast",AIエージェント,https://www.youtube.com/channel/UCJS9pqu9BzkAMNTmzNMNhvg,UCJS9pqu9BzkAMNTmzNMNhvg
https://www.youtube.com/watch?v=BWLiso9RrRA,Can an AI agent run a $1M influencer marketing campaign? | TechCrunch Disrupt 2025,AIエージェント,https://www.youtube.com/channel/UCCjyq_K1Xwfg8Lndy7lKMpA,UCCjyq_K1Xwfg8Lndy7lKMpA
https://www.youtube.com/watch?v=dD-oYfhSKhg,Ch 11: What are unitary operators? | Maths of Quantum Mechanics,Operator/ブラウザ自動化,https://www.youtube.com/channel/UCjZeJQVSkkydgZmSUucB9kA,UCjZeJQVSkkydgZmSUucB9kA
https://www.youtube.com/watch?v=A7yDvA8VQC8,Ch 14: Where does the momentum operator come from? | Maths of Quantum Mechanics,Operator/ブラウザ自動化,https://www.youtube.com/channel/UCjZeJQVSkkydgZmSUucB9kA,UCjZeJQVSkkydgZmSUucB9kA
https://www.youtube.com/watch?v=ANLRQ7X6h5A,Ch 7: How are observables operators? | Maths of Quantum Mechanics,Operator/ブラウザ自動化,https://www.youtube.com/channel/UCjZeJQVSkkydgZmSUucB9kA,UCjZeJQVSkkydgZmSUucB9kA
https://www.youtube.com/watch?v=da1rH0Hq62Q,Ch 9: What are Hermitian operators? | Maths of Quantum Mechanics,Operator/ブラウザ自動化,https://www.youtube.com/channel/UCjZeJQVSkkydgZmSUucB9kA,UCjZeJQVSkkydgZmSUucB9kA
https://www.youtube.com/watch?v=R8zCOp5WyLk,ChatGPT Agent Full Breakdown & More AI Use Cases,AIエージェント,https://www.youtube.com/channel/UCHhYXsLBEVVnbvsq57n1MTQ,UCHhYXsLBEVVnbvsq57n1MTQ
https://www.youtube.com/watch?v=KKdsSO1-LQE,ChatGPT Atlas - The Battle for your Browser,Operator/ブラウザ自動化,https://www.youtube.com/channel/UC55ODQSvARtgSyc8ThfiepQ,UC55ODQSvARtgSyc8ThfiepQ
https://www.youtube.com/watch?v=iT1fWrKhD9M,ChatGPT Atlas is live | Testing OpenAI's new AI browser,Operator/ブラウザ自動化,https://www.youtube.com/channel/UCqcbQf6yw5KzRoDDcZ_wBSw,UCqcbQf6yw5KzRoDDcZ_wBSw
https://www.youtube.com/watch?v=FXgOgAJrhis,ChatGPT Launched a New Browser You’ll Actually Use,Operator/ブラウザ自動化,https://www.youtube.com/channel/UChpleBmo18P08aKCIgti38g,UChpleBmo18P08aKCIgti38g
https://www.youtube.com/watch?v=sxTNACldK3Y,ChatGPT Operator is expensive....use this instead (FREE + Open Source),Operator/ブラウザ自動化,https://www.youtube.com/channel/UC9x0AN7BWHpCDHSm9NiJFJQ,UC9x0AN7BWHpCDHSm9NiJFJQ
https://www.youtube.com/watch?v=3RqfJoa_138,ChatGPT agent発表前にOpenAIの「AI時代のOS」構想の全容を妄想した一週間（2025年7月18日配信版）,AIエージェント,https://www.youtube.com/channel/UCtugWOg4u2SyuenPfeO1xYQ,UCtugWOg4u2SyuenPfeO1xYQ
https://www.youtube.com/watch?v=OX9b9hrMQCk,"ChatGPT is now a browser! A comprehensive explanation of OpenAI's free AI browser ""ChatGPT Atlas""!",Operator/ブラウザ自動化,https://www.youtube.com/channel/UCXo1SsIDZ_dke2Nr1r3qk6w,UCXo1SsIDZ_dke2Nr1r3qk6w
https://www.youtube.com/watch?v=oowzvdpH_2o,ChatGPT just became 100X more agentic…,AIエージェント,https://www.youtube.com/channel/UCPGrgwfbkjTIgPoOh2q1BAg,UCPGrgwfbkjTIgPoOh2q1BAg
https://www.youtube.com/watch?v=ZlAs79nW4P4,ChatGPT ❌ This Agentic AI ✅ (Game Changer) | Manus 1.5,AIエージェント,https://www.youtube.com/channel/UCeVMnSShP_Iviwkknt83cww,UCeVMnSShP_Iviwkknt83cww
https://www.youtube.com/watch?v=fOxC44g8vig,Claude Agent Skills Explained,AIエージェント,https://www.youtube.com/channel/UCrDwWp7EBBv4NwvScIpBDOA,UCrDwWp7EBBv4NwvScIpBDOA
https://www.youtube.com/watch?v=8izATKqcF-8,"Claude Code NEW Update IS HUGE! Sub Agents, Claude Ultra, LSPs, & MORE!",AIエージェント,https://www.youtube.com/channel/UC2WmuBuFq6gL08QYG-JjXKw,UC2WmuBuFq6gL08QYG-JjXKw
https://www.youtube.com/watch?v=OdtGN27LchE,Claude Code Skills just Built me an AI Agent Team (2026 Guide),AIエージェント,https://www.youtube.com/channel/UCMcoud_ZW7cfxeIugBflSBw,UCMcoud_ZW7cfxeIugBflSBw
https://www.youtube.com/watch?v=hWJBTQtmLoc,Claude Code Subagents Hack - Don't Sleep On THIS! + 5 WORDPRESS Subagents,AIエージェント,https://www.youtube.com/channel/UCGdOo5ARCSpxFQ-ssIsgi4Q,UCGdOo5ARCSpxFQ-ssIsgi4Q
https://www.youtube.com/watch?v=239JDMFuGcQ,Claude Code Subagents SIMPLIFIED in 7 Minutes! + QUICKSTART Tutorial,AIエージェント,https://www.youtube.com/channel/UCGdOo5ARCSpxFQ-ssIsgi4Q,UCGdOo5ARCSpxFQ-ssIsgi4Q
https://www.youtube.com/watch?v=7LlQZKPBKgs,Claude Code can build any AI Agent in n8n… just watch,AIエージェント,https://www.youtube.com/channel/UCPGrgwfbkjTIgPoOh2q1BAg,UCPGrgwfbkjTIgPoOh2q1BAg
https://www.youtube.com/watch?v=s71I9pVdsv8,"Claude Code has added new features (Hooks, SlashCommand, SubAgents), so I'll explain them here.",AIエージェント,https://www.youtube.com/channel/UCZQVTC3uLCyuJUOcRlguazA,UCZQVTC3uLCyuJUOcRlguazA
https://www.youtube.com/watch?v=KOK7wT4BEsw,"Claude Code is easy to use! I thought I could use the Claude Agent SDK, so I explained it.",AIエージェント,https://www.youtube.com/channel/UCZQVTC3uLCyuJUOcRlguazA,UCZQVTC3uLCyuJUOcRlguazA
https://www.youtube.com/watch?v=AXsrrF07u2k,Claude Code vs. Cursor vs. Codex: Cloud Agents Showdown,AIエージェント,https://www.youtube.com/channel/UCSxPE9PHHxQUEt6ajGmQyMA,UCSxPE9PHHxQUEt6ajGmQyMA
https://www.youtube.com/watch?v=QK6HBp_dJu0,Claude Opus 4.5: BEST Coding Model EVER! INSANE Agentic Capabilties! (Fully Tested),AIエージェント,https://www.youtube.com/channel/UC2WmuBuFq6gL08QYG-JjXKw,UC2WmuBuFq6gL08QYG-JjXKw
https://www.youtube.com/watch?v=fvUGQFtJaT4,Claude Skills - SOPs For Agents,AIエージェント,https://www.youtube.com/channel/UC55ODQSvARtgSyc8ThfiepQ,UC55ODQSvARtgSyc8ThfiepQ
https://www.youtube.com/watch?v=ALpxsPCE2Jw,Claude has finally released a browser. The AI ​​browser war is in full swing. And 6 other AI news...,Operator/ブラウザ自動化,https://www.youtube.com/channel/UCti6dG0zSAetLGGYcgNML4Q,UCti6dG0zSAetLGGYcgNML4Q
https://www.youtube.com/watch?v=mCS3xE81O04,Claude's new feature! Explaining what changes with Agent Skills,AIエージェント,https://www.youtube.com/channel/UCZQVTC3uLCyuJUOcRlguazA,UCZQVTC3uLCyuJUOcRlguazA
https://www.youtube.com/watch?v=wXtEcg8xH_k,Conversation and Chat Threads | OpenAI Agent SDK with Typescript,AIエージェント,https://www.youtube.com/channel/UCf9T51_FmMlfhiGpoes0yFA,UCf9T51_FmMlfhiGpoes0yFA
https://www.youtube.com/watch?v=6yEzQSEtO4Y,Core Components of an Agentic Workflow | Multi Agent Workflows for Beginners | Part 4,AIエージェント,https://www.youtube.com/channel/UCzL_0nIe8B4-7ShhVPfJkgw,UCzL_0nIe8B4-7ShhVPfJkgw
https://www.youtube.com/watch?v=Vm8QOo9MiC4,Create ANYTHING with Sora 2 + n8n AI Agents (Full Beginner's Guide),AIエージェント,https://www.youtube.com/channel/UC2ojq-nuP8ceeHqiroeKhBA,UC2ojq-nuP8ceeHqiroeKhBA
https://www.youtube.com/watch?v=oOylEw3tPQ8,"Cursor CEO: Going Beyond Code, Superintelligent AI Agents, And Why Taste Still Matters",AIエージェント,https://www.youtube.com/channel/UCcefcZRL2oaA_uBNeo5UOWg,UCcefcZRL2oaA_uBNeo5UOWg
https://www.youtube.com/watch?v=AU9Fdgs0ZaI,"David Luan: DeepSeek’s Significance, What’s Next for Agents & Lessons from OpenAI",AIエージェント,https://www.youtube.com/channel/UCUl-s_Vp-Kkk_XVyDylNwLA,UCUl-s_Vp-Kkk_XVyDylNwLA
https://www.youtube.com/watch?v=5iGSyS5M80A,Dead Internet Theory is now True | AgentKit by OpenAI | Apps in ChatGPT and other AI News,AIエージェント,https://www.youtube.com/channel/UCqcbQf6yw5KzRoDDcZ_wBSw,UCqcbQf6yw5KzRoDDcZ_wBSw
