url,title,tags,channel_url,channel_id
https://www.youtube.com/watch?v=EJB2Oj_VAk8,"AI Token Economics, Agent Swarms, and the Path to AGI | Val Bercovici, Chief AI Officer of Weka",AGI/ロードマップ|AIエージェント|フレームワーク,https://www.youtube.com/channel/UCHFEou9pndBIAW5NA200TAQ,UCHFEou9pndBIAW5NA200TAQ
https://www.youtube.com/watch?v=xeFPr1bBhj8,"João (Joe) Moura, Founder, CrewAI: Building an AI-Driven Company with Agents",AIエージェント|起業/新規事業|フレームワーク,https://www.youtube.com/channel/UCckOvibZFUOMpBZd2FDKhnw,UCckOvibZFUOMpBZd2FDKhnw
https://www.youtube.com/watch?v=_PxkYZ_4z50,"My Startup’s AI Agent Playbook for 5-10x Engineering Speed (with Claude Code, MCP’s, etc)",AIエージェント|起業/新規事業|フレームワーク,https://www.youtube.com/channel/UCEMA_xj3YeAI7Z6jsOw3peg,UCEMA_xj3YeAI7Z6jsOw3peg
https://www.youtube.com/watch?v=u5Vcrwpzoz8,"""I want Llama3 to perform 10x with my private knowledge"" - Local Agentic RAG w/ llama3",AIエージェント|フレームワーク,https://www.youtube.com/channel/UCrXSVX9a1mj8l0CMLwKgMVw,UCrXSVX9a1mj8l0CMLwKgMVw
https://www.youtube.com/watch?v=epAUEgF8OfQ,"#305 RAG 2.0 and The New Era of RAG Agents | Douwe Kiela, CEO at Contextual AI | Inventor of RAG",AIエージェント|フレームワーク,https://www.youtube.com/channel/UC79Gv3mYp6zKiSwYemEik9A,UC79Gv3mYp6zKiSwYemEik9A
https://www.youtube.com/watch?v=PYJSIp6JU94,"#319 Building & Managing Human+Agent Hybrid Teams with Karen Ng, Head of Product at HubSpot",AGI/ロードマップ|AIエージェント,https://www.youtube.com/channel/UC79Gv3mYp6zKiSwYemEik9A,UC79Gv3mYp6zKiSwYemEik9A
https://www.youtube.com/watch?v=jld--NLqTMg,#3【Dify挑戦編】Dify × Zapier連携！MCPプラグインを使ったAIエージェント開発,AIエージェント|フレームワーク,https://www.youtube.com/channel/UCjLBXoQdZUnJgl-nGAX6iJQ,UCjLBXoQdZUnJgl-nGAX6iJQ
https://www.youtube.com/watch?v=Chl-cRcwVpA,5-Getting Started With Agentic RAG With Detailed Implementation Using LangGraph,AIエージェント|フレームワーク,https://www.youtube.com/channel/UCNU_lfiiWBdtULKOw6X0Dig,UCNU_lfiiWBdtULKOw6X0Dig
https://www.youtube.com/watch?v=09tJS0ZEHms,AI Agent Crypto MCP Trading - Can AI make bag on Hyperliquid?,AIエージェント|フレームワーク,https://www.youtube.com/channel/UCR9j1jqqB5Rse69wjUnbYwA,UCR9j1jqqB5Rse69wjUnbYwA
https://www.youtube.com/watch?v=Y-rQSxACvOg,"AI Dev 25 x NYC | João Moura: Design, Develop, and Deploy Multi Agent Systems with CrewAI",AIエージェント|フレームワーク,https://www.youtube.com/channel/UCcIXc5mJsHVYTZR1maL5l9w,UCcIXc5mJsHVYTZR1maL5l9w
https://www.youtube.com/watch?v=Xel_mF5CCAo,AI Dev 25 x NYC | Scott Yak: Building MCP Servers That Make Agents More Effective,AIエージェント|フレームワーク,https://www.youtube.com/channel/UCcIXc5mJsHVYTZR1maL5l9w,UCcIXc5mJsHVYTZR1maL5l9w
https://www.youtube.com/watch?v=QGrLG_zqxJU,"AI, AIOps & Agentic AI in Data Storage Observability",AIエージェント|フレームワーク,https://www.youtube.com/channel/UCKWaEZ-_VweaEx1j62do_vQ,UCKWaEZ-_VweaEx1j62do_vQ
https://www.youtube.com/watch?v=Bk9sYapiow8,Advanced Agentic RAG And Its Types New Series-Generative AI,AIエージェント|フレームワーク,https://www.youtube.com/channel/UCNU_lfiiWBdtULKOw6X0Dig,UCNU_lfiiWBdtULKOw6X0Dig
https://www.youtube.com/watch?v=hSO4zjeQO48,Agentic AI 3.0 - Live Ultimate RAG Bootcamp Course Announcement,AIエージェント|フレームワーク,https://www.youtube.com/channel/UCNU_lfiiWBdtULKOw6X0Dig,UCNU_lfiiWBdtULKOw6X0Dig
https://www.youtube.com/watch?v=goc2yyg2eH4,Agentic AI Transformation: Workforce Strategy & Leadership | Amazon Web Services,Operator/ブラウザ自動化|AIエージェント,https://www.youtube.com/channel/UCd6MoB9NC6uYN2grvUNT-Zg,UCd6MoB9NC6uYN2grvUNT-Zg
https://www.youtube.com/watch?v=dIb-DujRNEo,Agentic AI With Langgraph And MCP Crash Course-Part 1,AIエージェント|フレームワーク,https://www.youtube.com/channel/UCNU_lfiiWBdtULKOw6X0Dig,UCNU_lfiiWBdtULKOw6X0Dig
https://www.youtube.com/watch?v=KurGnK76-EU,Agentic RAG Simply Explained,AIエージェント|フレームワーク,https://www.youtube.com/channel/UCh9nVJoWXmFb7sLApWGcLPQ,UCh9nVJoWXmFb7sLApWGcLPQ
https://www.youtube.com/watch?v=CAKGKkWf0tI,"Anatomy of AI Agents: Inside LLMs, RAG Systems, & Generative AI",AIエージェント|フレームワーク,https://www.youtube.com/channel/UCKWaEZ-_VweaEx1j62do_vQ,UCKWaEZ-_VweaEx1j62do_vQ
https://www.youtube.com/watch?v=WozA_qHEAqo,"BeeAI Framework: Extending LLMs with Tools, RAG, & AI Agents",AIエージェント|フレームワーク,https://www.youtube.com/channel/UCKWaEZ-_VweaEx1j62do_vQ,UCKWaEZ-_VweaEx1j62do_vQ
https://www.youtube.com/watch?v=Be2OQ3LQZcQ,Build a RAG AI Agent with REAL-TIME Source Validation (CopilotKit + Pydantic AI),AIエージェント|フレームワーク,https://www.youtube.com/channel/UCMwVTLZIRRUyyVrkjDpn4pA,UCMwVTLZIRRUyyVrkjDpn4pA
https://www.youtube.com/watch?v=hLSTGgc7gDc,Building agentic RAG for e-commerce with ADK and Vector Search,AIエージェント|フレームワーク,https://www.youtube.com/channel/UCJS9pqu9BzkAMNTmzNMNhvg,UCJS9pqu9BzkAMNTmzNMNhvg
https://www.youtube.com/watch?v=1WImBwiA7RA,Claude Skills - the SOP for your agent that is bigger than MCP,AIエージェント|フレームワーク,https://www.youtube.com/channel/UCrXSVX9a1mj8l0CMLwKgMVw,UCrXSVX9a1mj8l0CMLwKgMVw
https://www.youtube.com/watch?v=BER3EhUIyz0,Claude plays Catan: Managing agent context with Sonnet 4.5,AGI/ロードマップ|AIエージェント,https://www.youtube.com/channel/UCrDwWp7EBBv4NwvScIpBDOA,UCrDwWp7EBBv4NwvScIpBDOA
https://www.youtube.com/watch?v=JnKkdHaatwU,Connecting ADK Agents to MCP Servers,AIエージェント|フレームワーク,https://www.youtube.com/channel/UCJS9pqu9BzkAMNTmzNMNhvg,UCJS9pqu9BzkAMNTmzNMNhvg
https://www.youtube.com/watch?v=G42J2MSKyc8,CrewAI Tutorial | Agentic AI Tutorial,AIエージェント|フレームワーク,https://www.youtube.com/channel/UCh9nVJoWXmFb7sLApWGcLPQ,UCh9nVJoWXmFb7sLApWGcLPQ
https://www.youtube.com/watch?v=7iAWXJO-MbY,Cursor 2.0 Agent Mode & Testing with MCP Servers,AIエージェント|フレームワーク,https://www.youtube.com/channel/UCf9T51_FmMlfhiGpoes0yFA,UCf9T51_FmMlfhiGpoes0yFA
https://www.youtube.com/watch?v=guXhZ_q6sVY,"Design, Develop, and Deploy Multi-Agent Systems with CrewAI",AIエージェント|フレームワーク,https://www.youtube.com/channel/UCcIXc5mJsHVYTZR1maL5l9w,UCcIXc5mJsHVYTZR1maL5l9w
https://www.youtube.com/watch?v=Y_5eTTw6p58,"Full stack AI with Python: LLMs, RAG, Agents and LangGraph (Udemy)",AIエージェント|フレームワーク,https://www.youtube.com/channel/UCXgGY0wkgOzynnHvSEVmE3A,UCXgGY0wkgOzynnHvSEVmE3A
https://www.youtube.com/watch?v=6B0p9rCN_p0,GPT-5 Codex: The Best Agentic Coding Model? | MCP Testing,AIエージェント|フレームワーク,https://www.youtube.com/channel/UCR9j1jqqB5Rse69wjUnbYwA,UCR9j1jqqB5Rse69wjUnbYwA
https://www.youtube.com/watch?v=od5zckQpJRo,Gemini 2.5 Computer Use MCP | On The Edge #7,Operator/ブラウザ自動化|フレームワーク,https://www.youtube.com/channel/UCR9j1jqqB5Rse69wjUnbYwA,UCR9j1jqqB5Rse69wjUnbYwA
https://www.youtube.com/watch?v=Hu3lQfg20Og,Gemini 3.0 Computer Use: Google's FULLY FREE Browser Use AI Agent! Automate ANYTHING! (Ranked #1),Operator/ブラウザ自動化|AIエージェント,https://www.youtube.com/channel/UC2WmuBuFq6gL08QYG-JjXKw,UC2WmuBuFq6gL08QYG-JjXKw
https://www.youtube.com/watch?v=irg-2IfAjpo,Gemini's New File Search Just Leveled Up RAG Agents (10x Cheaper),AIエージェント|フレームワーク,https://www.youtube.com/channel/UC2ojq-nuP8ceeHqiroeKhBA,UC2ojq-nuP8ceeHqiroeKhBA
https://www.youtube.com/watch?v=RDvKjiR9bBU,How To Use OpenAI Agent MCPs For Beginners,AIエージェント|フレームワーク,https://www.youtube.com/channel/UCJFMlSxcvlZg5yZUYJT0Pug,UCJFMlSxcvlZg5yZUYJT0Pug
https://www.youtube.com/watch?v=ASjITM7lVC8,How to Add a Smart AI Agent to Your Website in 2025,Operator/ブラウザ自動化|AIエージェント,https://www.youtube.com/channel/UCwSozl89jl2zUDzQ4jGJD3g,UCwSozl89jl2zUDzQ4jGJD3g
https://www.youtube.com/watch?v=TvW4A0a75mw,How to Build Your First RAG Agent with Agent Development Kit (ADK + Vertex AI RAG Service),AIエージェント|フレームワーク,https://www.youtube.com/channel/UCEzrs7gK6Nf6t_tadEprzxQ,UCEzrs7gK6Nf6t_tadEprzxQ
https://www.youtube.com/watch?v=AUQJ9eeP-Ls,How to Build a Production-Ready RAG AI Agent in Python (Step-by-Step),AIエージェント|フレームワーク,https://www.youtube.com/channel/UC4JX40jDee_tINbkjycV4Sg,UC4JX40jDee_tINbkjycV4Sg
https://www.youtube.com/watch?v=p0FERNkpyHE,Introducing RAG 2.0: Agentic RAG + Knowledge Graphs (FREE Template),AIエージェント|フレームワーク,https://www.youtube.com/channel/UCMwVTLZIRRUyyVrkjDpn4pA,UCMwVTLZIRRUyyVrkjDpn4pA
https://www.youtube.com/watch?v=rohkXyzbryI,"Is WordPress outdated? We tried out ""Readdy,"" an AI agent specialized in web development that can...",Operator/ブラウザ自動化|AIエージェント,https://www.youtube.com/channel/UCfapRkagDtoQEkGeyD3uERQ,UCfapRkagDtoQEkGeyD3uERQ
https://www.youtube.com/watch?v=mv7G38U8iYY,"Jason Lopatecki, CEO & Co-founder, Arize: Beyond Black Boxes: Rigorous Evaluation of AI Agents",AIエージェント|起業/新規事業,https://www.youtube.com/channel/UCckOvibZFUOMpBZd2FDKhnw,UCckOvibZFUOMpBZd2FDKhnw
https://www.youtube.com/watch?v=J7j5tCB_y4w,LangChain Full Crash Course - AI Agents in Python,AIエージェント|フレームワーク,https://www.youtube.com/channel/UC8wZnXYK_CGKlBcZp-GxYPA,UC8wZnXYK_CGKlBcZp-GxYPA
https://www.youtube.com/watch?v=HkzOrj2qeXI,MCP + Agent Development Kit (ADK): Crash Course,AIエージェント|フレームワーク,https://www.youtube.com/channel/UCEzrs7gK6Nf6t_tadEprzxQ,UCEzrs7gK6Nf6t_tadEprzxQ
https://www.youtube.com/watch?v=3qjb6RL3nJo,MCP - Model Context Protocol | OpenAI Agent SDK with Typescript,AIエージェント|フレームワーク,https://www.youtube.com/channel/UCf9T51_FmMlfhiGpoes0yFA,UCf9T51_FmMlfhiGpoes0yFA
https://www.youtube.com/watch?v=X95MFcYH1_s,MCP vs. RAG: How AI Agents & LLMs Connect to Data,AIエージェント|フレームワーク,https://www.youtube.com/channel/UCKWaEZ-_VweaEx1j62do_vQ,UCKWaEZ-_VweaEx1j62do_vQ
https://www.youtube.com/watch?v=Ons1Fv3IE4U,Orchestrator Agents & MCP: How AI Agents Drive Automation,AIエージェント|フレームワーク,https://www.youtube.com/channel/UCKWaEZ-_VweaEx1j62do_vQ,UCKWaEZ-_VweaEx1j62do_vQ
https://www.youtube.com/watch?v=v0btR9rK5NM,Panel 3: Security and Governance in MCP Deployment | Future of Data and AI | Agentic AI Conference,AIエージェント|フレームワーク,https://www.youtube.com/channel/UCzL_0nIe8B4-7ShhVPfJkgw,UCzL_0nIe8B4-7ShhVPfJkgw
https://www.youtube.com/watch?v=04Gap8vWV28,Power your AI agents with MCP tools on Google Cloud Run,AIエージェント|フレームワーク,https://www.youtube.com/channel/UCJS9pqu9BzkAMNTmzNMNhvg,UCJS9pqu9BzkAMNTmzNMNhvg
https://www.youtube.com/watch?v=yKPAwTF1SGY,Preparing IT for AI Agents: How MCP Shapes the Future of AI,AIエージェント|フレームワーク,https://www.youtube.com/channel/UCKWaEZ-_VweaEx1j62do_vQ,UCKWaEZ-_VweaEx1j62do_vQ
https://www.youtube.com/watch?v=Dc1y_pulshw,"RAG is dead, long live RAG: Retrieval in the age of agents - LightOn @ Fully Connected London '25",AIエージェント|フレームワーク,https://www.youtube.com/channel/UCBp3w4DCEC64FZr4k9ROxig,UCBp3w4DCEC64FZr4k9ROxig
https://www.youtube.com/watch?v=fB2JQXEH_94,RAG vs Agentic AI: How LLMs Connect Data for Smarter AI,AIエージェント|フレームワーク,https://www.youtube.com/channel/UCKWaEZ-_VweaEx1j62do_vQ,UCKWaEZ-_VweaEx1j62do_vQ
https://www.youtube.com/watch?v=RJXio_jpc_Y,SEM Startup Procedure and Demonstration - Electron Microscopy In The Garage,起業/新規事業|フレームワーク,https://www.youtube.com/channel/UC7E8-0Ou69hwScPW1_fQApA,UC7E8-0Ou69hwScPW1_fQApA
https://www.youtube.com/watch?v=3p11YqelPLs,"Sander van Donkelaar - Building, Deploying and Managing AI Agents at Scale - PyData Eindhoven 2025",AGI/ロードマップ|AIエージェント,https://www.youtube.com/channel/UCOjD18EJYcsBog4IozkF_7w,UCOjD18EJYcsBog4IozkF_7w
https://www.youtube.com/watch?v=US18jDIDUfQ,Scale AI builds agentic workflows with AWS | Amazon Web Services,Operator/ブラウザ自動化|AIエージェント,https://www.youtube.com/channel/UCd6MoB9NC6uYN2grvUNT-Zg,UCd6MoB9NC6uYN2grvUNT-Zg
https://www.youtube.com/watch?v=7EH0VjM3dTk,"SemiAnalysis Founder Dylan Patel on New AI Regulations, Chinese AI & xAI's Surge to Hyperscale",Macrohard/xAI|起業/新規事業,https://www.youtube.com/channel/UCUl-s_Vp-Kkk_XVyDylNwLA,UCUl-s_Vp-Kkk_XVyDylNwLA
https://www.youtube.com/watch?v=8mvUXjpqzUU,Simplilearn Reviews | How Victor Pivoted His Career with Agile Skills #GetCertifiedGetAhead,AGI/ロードマップ|MVP/PMF/リーン,https://www.youtube.com/channel/UCsvqVGtbbyHaMoevxPAq9Fg,UCsvqVGtbbyHaMoevxPAq9Fg
https://www.youtube.com/watch?v=ciE8IHxsKno,Suger.io builds agentic AI go-to-market workflows with AWS | Amazon Web Services,Operator/ブラウザ自動化|AIエージェント,https://www.youtube.com/channel/UCd6MoB9NC6uYN2grvUNT-Zg,UCd6MoB9NC6uYN2grvUNT-Zg
https://www.youtube.com/watch?v=lqokpIme47A,The Finance Startup Bringing Agentic AI to Wall Street,AIエージェント|起業/新規事業,https://www.youtube.com/channel/UCcefcZRL2oaA_uBNeo5UOWg,UCcefcZRL2oaA_uBNeo5UOWg
https://www.youtube.com/watch?v=QojPKL96Dx4,The NEW Easiest Way to Build RAG Agents in Minutes (no code),AIエージェント|フレームワーク,https://www.youtube.com/channel/UC2ojq-nuP8ceeHqiroeKhBA,UC2ojq-nuP8ceeHqiroeKhBA
https://www.youtube.com/watch?v=X39OZndIWSY,The Startup Powering The Data Behind AGI,AGI/ロードマップ|起業/新規事業,https://www.youtube.com/channel/UCBp3w4DCEC64FZr4k9ROxig,UCBp3w4DCEC64FZr4k9ROxig
https://www.youtube.com/watch?v=l3u_FAv33G0,The arrival of AGI | Shane Legg (co-founder of DeepMind),AGI/ロードマップ|起業/新規事業,https://www.youtube.com/channel/UCP7jMXSY2xbc3KCAE0MHQ-A,UCP7jMXSY2xbc3KCAE0MHQ-A
https://www.youtube.com/watch?v=JYZXsH1Xz0I,The power of context: From traditional RAG to multi-agent retrieval - Contextual AI @ FC London '25,AIエージェント|フレームワーク,https://www.youtube.com/channel/UCBp3w4DCEC64FZr4k9ROxig,UCBp3w4DCEC64FZr4k9ROxig
https://www.youtube.com/watch?v=TlIOk8VuEBU,Tool Calling VS MCP in AI Agents | Model Context Protocol Explained,AIエージェント|フレームワーク,https://www.youtube.com/channel/UCf9T51_FmMlfhiGpoes0yFA,UCf9T51_FmMlfhiGpoes0yFA
https://www.youtube.com/watch?v=fqcKRn4ZjDI,Toolhouse: First-Ever Agent UI - Fastest & Easiest Way to Create AI Agents! NEW MCP + Toolkit!,AIエージェント|フレームワーク,https://www.youtube.com/channel/UC2WmuBuFq6gL08QYG-JjXKw,UC2WmuBuFq6gL08QYG-JjXKw
https://www.youtube.com/watch?v=iWtVbgqFSFg,"Top 20 AI News Stories: OpenAI Devday 2025, Agentkit, Gemini Enterprise, MCP Update, Define Knowl...",AIエージェント|フレームワーク,https://www.youtube.com/channel/UCpUQnk6MaY4o3NdgJmv10cw,UCpUQnk6MaY4o3NdgJmv10cw
https://www.youtube.com/watch?v=ObAFqcuX9MA,"Trae AI- Better Than Cursor IDE? MCP Integration, Custom AI Agents With MCP Tutorials",AIエージェント|フレームワーク,https://www.youtube.com/channel/UCNU_lfiiWBdtULKOw6X0Dig,UCNU_lfiiWBdtULKOw6X0Dig
https://www.youtube.com/watch?v=WVrLGsq48dc,Trellix accelerates security workflows with agentic AI on AWS | Amazon Web Services,Operator/ブラウザ自動化|AIエージェント,https://www.youtube.com/channel/UCd6MoB9NC6uYN2grvUNT-Zg,UCd6MoB9NC6uYN2grvUNT-Zg
https://www.youtube.com/watch?v=xOO8Wt_i72s,Turn Claude Code into Your Own INCREDIBLE UI Designer (using Playwright MCP Subagents),AIエージェント|フレームワーク,https://www.youtube.com/channel/UCEMA_xj3YeAI7Z6jsOw3peg,UCEMA_xj3YeAI7Z6jsOw3peg
https://www.youtube.com/watch?v=_0qEIu78LYs,Tutorial: Building GraphRAG for All Data Types | Future of Data and AI | Agentic AI Conference,AIエージェント|フレームワーク,https://www.youtube.com/channel/UCzL_0nIe8B4-7ShhVPfJkgw,UCzL_0nIe8B4-7ShhVPfJkgw
https://www.youtube.com/watch?v=4P0mtuGfyx8,Udemy- Complete Agentic AI Bootcamp With LangGraph And LangChain Is Live,AIエージェント|フレームワーク,https://www.youtube.com/channel/UCNU_lfiiWBdtULKOw6X0Dig,UCNU_lfiiWBdtULKOw6X0Dig
https://www.youtube.com/watch?v=5p5cV0yVDvQ,Unlock the Full Power of Your n8n Agents (new instance MCP),AIエージェント|フレームワーク,https://www.youtube.com/channel/UC2ojq-nuP8ceeHqiroeKhBA,UC2ojq-nuP8ceeHqiroeKhBA
https://www.youtube.com/watch?v=sMQ5R92F86o,"Unlocking Smarter AI Agents with Unstructured Data, RAG & Vector Databases",AIエージェント|フレームワーク,https://www.youtube.com/channel/UCKWaEZ-_VweaEx1j62do_vQ,UCKWaEZ-_VweaEx1j62do_vQ
https://www.youtube.com/watch?v=vzJOAnwIokM,Updated Langchain Version V1 Crash Course- Build Autonomous Agents,AIエージェント|フレームワーク,https://www.youtube.com/channel/UCNU_lfiiWBdtULKOw6X0Dig,UCNU_lfiiWBdtULKOw6X0Dig
https://www.youtube.com/watch?v=iV5RZ_XKXBc,Your ULTIMATE n8n RAG AI Agent Template just got a Massive Upgrade,AIエージェント|フレームワーク,https://www.youtube.com/channel/UCMwVTLZIRRUyyVrkjDpn4pA,UCMwVTLZIRRUyyVrkjDpn4pA
https://www.youtube.com/watch?v=dWeWL0qRmag,phData develops agentic AI frameworks using AWS | Amazon Web Services,Operator/ブラウザ自動化|AIエージェント,https://www.youtube.com/channel/UCd6MoB9NC6uYN2grvUNT-Zg,UCd6MoB9NC6uYN2grvUNT-Zg
https://www.youtube.com/watch?v=ZB_U5QlyY0Y,rtrvr.ai v2: FULLY FREE Browser Use AI Agent! Automate ANYTHING! (Ranked #1 AI Web Agent),Operator/ブラウザ自動化|AIエージェント,https://www.youtube.com/channel/UC2WmuBuFq6gL08QYG-JjXKw,UC2WmuBuFq6gL08QYG-JjXKw
https://www.youtube.com/watch?v=npkGMKCD9wI,【AIエージェント活用術 vol.7】PIVOT MC野嶋が挑戦！ノーコードでも作れる Difyを使ったAIエージェント開発／イチから解説「戦略企画エージェント」の作り方,AIエージェント|MVP/PMF/リーン,https://www.youtube.com/channel/UC8yHePe_RgUBE-waRWy6olw,UC8yHePe_RgUBE-waRWy6olw
https://www.youtube.com/watch?v=HEknPXDlTmc,【週刊AI】「AGI達成したことにして次に行きましょう」(Sam Altman氏）。業界のオピニオンリーダーKarpathy氏の2025年総括,AGI/ロードマップ|Operator/ブラウザ自動化,https://www.youtube.com/channel/UCtugWOg4u2SyuenPfeO1xYQ,UCtugWOg4u2SyuenPfeO1xYQ
https://www.youtube.com/watch?v=MGkByeDm-90,"""Make Agent 10x cheaper, faster & better?"" - LLM System Evaluation 101",AIエージェント,https://www.youtube.com/channel/UCrXSVX9a1mj8l0CMLwKgMVw,UCrXSVX9a1mj8l0CMLwKgMVw
https://www.youtube.com/watch?v=EWBsmEi4V9g,#0 [Introduction to AI Agents] Basic knowledge about AI agents for beginners!,AIエージェント,https://www.youtube.com/channel/UCjLBXoQdZUnJgl-nGAX6iJQ,UCjLBXoQdZUnJgl-nGAX6iJQ
https://www.youtube.com/watch?v=Q9VBfj_LzUI,#14 Operators in Python,Operator/ブラウザ自動化,https://www.youtube.com/channel/UC59K-uG2A5ogwIrHw4bmlEg,UC59K-uG2A5ogwIrHw4bmlEg
https://www.youtube.com/watch?v=weJ83HRc5zU,#16【Dify入門】Dify×Perplexity連携挑戦！飲食店検索AIエージェント,AIエージェント,https://www.youtube.com/channel/UCjLBXoQdZUnJgl-nGAX6iJQ,UCjLBXoQdZUnJgl-nGAX6iJQ
https://www.youtube.com/watch?v=LMr4FjgLIzE,#20 【Dify入門】新機能『AIエージェントノード』をゼロから理解しよう！,AIエージェント,https://www.youtube.com/channel/UCjLBXoQdZUnJgl-nGAX6iJQ,UCjLBXoQdZUnJgl-nGAX6iJQ
https://www.youtube.com/watch?v=OSeVMcz8p-A,#3 【n8n入門 】AIエージェントで“自動ポケモン図鑑”を作る！初心者でも今すぐ動かせる手順を解説！,AIエージェント,https://www.youtube.com/channel/UCjLBXoQdZUnJgl-nGAX6iJQ,UCjLBXoQdZUnJgl-nGAX6iJQ
https://www.youtube.com/watch?v=t8jNXTe2_Gk,"#316 Enterprise AI Agents with Jun Qian, VP of Generative AI Services at Oracle",AIエージェント,https://www.youtube.com/channel/UC79Gv3mYp6zKiSwYemEik9A,UC79Gv3mYp6zKiSwYemEik9A
https://www.youtube.com/watch?v=nTD4wZBC0CI,"#328 The Challenges of Enterprise Agentic AI | Manasi Vartak, Chief AI Architect at Cloudera",AIエージェント,https://www.youtube.com/channel/UC79Gv3mYp6zKiSwYemEik9A,UC79Gv3mYp6zKiSwYemEik9A
https://www.youtube.com/watch?v=SyS-GJ1p8Fo,"#329 Building Trust in AI Agents | Shane Murray, SVP of Digital Platform Analytics at Versant Media",AIエージェント,https://www.youtube.com/channel/UC79Gv3mYp6zKiSwYemEik9A,UC79Gv3mYp6zKiSwYemEik9A
https://www.youtube.com/watch?v=2YLoX7FSwYQ,#50 Operator Overloading in Python,Operator/ブラウザ自動化,https://www.youtube.com/channel/UC59K-uG2A5ogwIrHw4bmlEg,UC59K-uG2A5ogwIrHw4bmlEg
https://www.youtube.com/watch?v=_vrPvYBtmTk,#6 [Dify Challenge] What is Parent-Child Chunk? Sales Analysis AI Agent Development Challenge,AIエージェント,https://www.youtube.com/channel/UCjLBXoQdZUnJgl-nGAX6iJQ,UCjLBXoQdZUnJgl-nGAX6iJQ
https://www.youtube.com/watch?v=38eCCc9ffIw,#6【MCP入門 】Claude × Dify 連携で業務自動化！話すだけで企業調査が完了する方法とは？,フレームワーク,https://www.youtube.com/channel/UCjLBXoQdZUnJgl-nGAX6iJQ,UCjLBXoQdZUnJgl-nGAX6iJQ
https://www.youtube.com/watch?v=Pe_Cyp2Fyjg,#7【MCP入門 】AI自動操作で企業問い合わせを自動化してみよう！,フレームワーク,https://www.youtube.com/channel/UCjLBXoQdZUnJgl-nGAX6iJQ,UCjLBXoQdZUnJgl-nGAX6iJQ
https://www.youtube.com/watch?v=fbPDcVnY1gk,#8 [AI-Driven Development] Basic knowledge of OpenAI AgentKit that beginners should know!,AIエージェント,https://www.youtube.com/channel/UCjLBXoQdZUnJgl-nGAX6iJQ,UCjLBXoQdZUnJgl-nGAX6iJQ
https://www.youtube.com/watch?v=ouaEORSQatY,(再アップ)AIエージェントから A to Aへ (AIビジネスの基礎知識) 超知能&近未来社会 AI Business Note 第1回 9/16収録,AIエージェント,https://www.youtube.com/channel/UCKaQevFzchUw5TzqjL_tBRQ,UCKaQevFzchUw5TzqjL_tBRQ
https://www.youtube.com/watch?v=MW3t6jP9AOs,.agent folder is making claude code 10x better...,AIエージェント,https://www.youtube.com/channel/UCrXSVX9a1mj8l0CMLwKgMVw,UCrXSVX9a1mj8l0CMLwKgMVw
https://www.youtube.com/watch?v=HMymN0O1hrM,10x Terminals with AI Coding Agents = 100x Dev? - Codex + Claude Code,AIエージェント,https://www.youtube.com/channel/UCR9j1jqqB5Rse69wjUnbYwA,UCR9j1jqqB5Rse69wjUnbYwA
https://www.youtube.com/watch?v=KIOmoUrlKn0,"21 Popular AI News Items - Gamma 3.0, Notion 3.0, Gem Sharing, Zoom 3.0, Amazon's Sales AI Agent,...",AIエージェント,https://www.youtube.com/channel/UCpUQnk6MaY4o3NdgJmv10cw,UCpUQnk6MaY4o3NdgJmv10cw
https://www.youtube.com/watch?v=NAwykfigzQ4,"22 Top AI News Items - Gemini 3, Nano Banana Pro, Slide Creation with NotebookLM, Free Agent Mode...",AIエージェント,https://www.youtube.com/channel/UCpUQnk6MaY4o3NdgJmv10cw,UCpUQnk6MaY4o3NdgJmv10cw
https://www.youtube.com/watch?v=rooK0exeBQU,"23 Must-See AI News Stories: Claude Skills, Copilot Vision, Gemini 3.0, DGX Spark, Agentforce360,...",AIエージェント,https://www.youtube.com/channel/UCpUQnk6MaY4o3NdgJmv10cw,UCpUQnk6MaY4o3NdgJmv10cw
https://www.youtube.com/watch?v=Onw9znAKHWQ,"25 Top AI News Stories: Sora, Claude 4.5, Copilot Agent Mode, ChatGPT Shared Projects, Canva AI, ...",AIエージェント,https://www.youtube.com/channel/UCpUQnk6MaY4o3NdgJmv10cw,UCpUQnk6MaY4o3NdgJmv10cw
https://www.youtube.com/watch?v=lcNN3X9gXls,3 Hidden Data Table Hacks for Smarter AI Agents,AIエージェント,https://www.youtube.com/channel/UC2ojq-nuP8ceeHqiroeKhBA,UC2ojq-nuP8ceeHqiroeKhBA
https://www.youtube.com/watch?v=mnQmBFJEqPg,6 simple AI Agents you must have - beginners guide,AIエージェント,https://www.youtube.com/channel/UCPGrgwfbkjTIgPoOh2q1BAg,UCPGrgwfbkjTIgPoOh2q1BAg
https://www.youtube.com/watch?v=ELBIb8z0jxc,7 New AI Agents You Won’t Believe,AIエージェント,https://www.youtube.com/channel/UCwSozl89jl2zUDzQ4jGJD3g,UCwSozl89jl2zUDzQ4jGJD3g
https://www.youtube.com/watch?v=PADG1LqgVo8,70% of Enterprises Adopt AI Agents: The Real-World Impact,AIエージェント,https://www.youtube.com/channel/UCHFEou9pndBIAW5NA200TAQ,UCHFEou9pndBIAW5NA200TAQ
https://www.youtube.com/watch?v=ZHCB09O6zUk,A Brief History of AI: From Machine Learning to Gen AI to Agentic AI,AIエージェント,https://www.youtube.com/channel/UCKWaEZ-_VweaEx1j62do_vQ,UCKWaEZ-_VweaEx1j62do_vQ
https://www.youtube.com/watch?v=JIDil4HVcrw,A brain-inspired agentic architecture to improve planning with LLMs,AIエージェント,https://www.youtube.com/channel/UCCb9_Kn8F_Opb3UCGm-lILQ,UCCb9_Kn8F_Opb3UCGm-lILQ
https://www.youtube.com/watch?v=BFWviieMyGw,AG-UI Just Released: The NEW WAVE of AI Agent Apps,AIエージェント,https://www.youtube.com/channel/UCMwVTLZIRRUyyVrkjDpn4pA,UCMwVTLZIRRUyyVrkjDpn4pA
https://www.youtube.com/watch?v=4OOS96i2gfI,AI Agents Are Overused. Here’s What to Build Instead,AIエージェント,https://www.youtube.com/channel/UC2ojq-nuP8ceeHqiroeKhBA,UC2ojq-nuP8ceeHqiroeKhBA
https://www.youtube.com/watch?v=BiN-NTTQ7tc,AI Agents Explained: The Technology That's Changing Everything (2025 Guide) & How to Build Your Own,AIエージェント,https://www.youtube.com/channel/UC4MZ7zUHb5eAxU75Dc_nqdQ,UC4MZ7zUHb5eAxU75Dc_nqdQ
https://www.youtube.com/watch?v=leC9vkDsGqM,AI Agents and Data Integration: Redefining Data Engineering,AIエージェント,https://www.youtube.com/channel/UCKWaEZ-_VweaEx1j62do_vQ,UCKWaEZ-_VweaEx1j62do_vQ
