url,title,tags,channel_url,channel_id
https://www.youtube.com/watch?v=rMO_P4nnATI,Deep Agent Builder: Easily Create AI Agents That Can Automate Anything! n8n Alternative!,AIエージェント,https://www.youtube.com/channel/UC2WmuBuFq6gL08QYG-JjXKw,UC2WmuBuFq6gL08QYG-JjXKw
https://www.youtube.com/watch?v=k-qPKE8pZAw,"DeepSeek‑r1, o3‑mini & Gemini Flash 2.0: Which model should you use in your AI Agents?",AIエージェント,https://www.youtube.com/channel/UCEzrs7gK6Nf6t_tadEprzxQ,UCEzrs7gK6Nf6t_tadEprzxQ
https://www.youtube.com/watch?v=igUpMlGqyWo,Defining factors for enterprise AI agents - JetBrains @ FC London '25,AIエージェント,https://www.youtube.com/channel/UCBp3w4DCEC64FZr4k9ROxig,UCBp3w4DCEC64FZr4k9ROxig
https://www.youtube.com/watch?v=uMVRPqC7cL4,Demonstration of app creation using OpenAI's AgentKit (Agent Builder & Chatkit),AIエージェント,https://www.youtube.com/channel/UCfapRkagDtoQEkGeyD3uERQ,UCfapRkagDtoQEkGeyD3uERQ
https://www.youtube.com/watch?v=A4UOeBpgNU0,Designing for Autonomy: How Agentic AI Will Reshape Enterprise Architecture | VB Transform 2025,AIエージェント,https://www.youtube.com/channel/UCHFEou9pndBIAW5NA200TAQ,UCHFEou9pndBIAW5NA200TAQ
https://www.youtube.com/watch?v=DChzGCf1pOo,Engineer Autonomous AI Agents – Infrastructure for Next-Level Customer Experience VB Transform 2025,AIエージェント,https://www.youtube.com/channel/UCHFEou9pndBIAW5NA200TAQ,UCHFEou9pndBIAW5NA200TAQ
https://www.youtube.com/watch?v=rTKt5Wv_HTI,Eric Ma - Building LLM Agents Made Simple a - PyData Boston 2025,AIエージェント,https://www.youtube.com/channel/UCOjD18EJYcsBog4IozkF_7w,UCOjD18EJYcsBog4IozkF_7w
https://www.youtube.com/watch?v=x2n_kbeUODI,Ex-OpenAI Founder Deposition is WILD,起業/新規事業,https://www.youtube.com/channel/UCawZsQWqfGSbCI5yjkdVkTA,UCawZsQWqfGSbCI5yjkdVkTA
https://www.youtube.com/watch?v=lB8jythC-vQ,From Models to Agentic Systems: The Next Enterprise AI S-Curve | Andrew Ng joins VB Transform 2025,AIエージェント,https://www.youtube.com/channel/UCHFEou9pndBIAW5NA200TAQ,UCHFEou9pndBIAW5NA200TAQ
https://www.youtube.com/watch?v=OtJV9SCyfuE,Full Stack AI Agent course with inngest and Gemini,AIエージェント,https://www.youtube.com/channel/UCXgGY0wkgOzynnHvSEVmE3A,UCXgGY0wkgOzynnHvSEVmE3A
https://www.youtube.com/watch?v=YoRNgLXzrVo,Fully Connected 2025 kickoff: The rise (and the challenges) of the agentic era,AIエージェント,https://www.youtube.com/channel/UCBp3w4DCEC64FZr4k9ROxig,UCBp3w4DCEC64FZr4k9ROxig
https://www.youtube.com/watch?v=khZS7dMkqek,Fully Connected London 2025: Agentic AI applications from prototype to production,AIエージェント,https://www.youtube.com/channel/UCBp3w4DCEC64FZr4k9ROxig,UCBp3w4DCEC64FZr4k9ROxig
https://www.youtube.com/watch?v=fpAbYRNxYPM,"GPT 5.2, realtime video editor, AI stereo videos, mobile AI agents, full body control: AI NEWS",AIエージェント,https://www.youtube.com/channel/UCIgnGlGkVRhd4qNFcEwLL4A,UCIgnGlGkVRhd4qNFcEwLL4A
https://www.youtube.com/watch?v=eRl6UWSjlxM,GPT-5 Pro is the most powerful AI agent ever… just watch,AIエージェント,https://www.youtube.com/channel/UCPGrgwfbkjTIgPoOh2q1BAg,UCPGrgwfbkjTIgPoOh2q1BAg
https://www.youtube.com/watch?v=PA6tjgpDvHU,Gemini 3 + Deep Think: Enhancing Gemini to Become a Super Agent! Build & Automate ANYTHING!,AIエージェント,https://www.youtube.com/channel/UC2WmuBuFq6gL08QYG-JjXKw,UC2WmuBuFq6gL08QYG-JjXKw
https://www.youtube.com/watch?v=nHkS-JQyThE,Gemini 3.0 Pro Coder: Powerful Autonomous AI Coding Agent Can Build ANYTHING & IS FULLY FREE!,AIエージェント,https://www.youtube.com/channel/UC2WmuBuFq6gL08QYG-JjXKw,UC2WmuBuFq6gL08QYG-JjXKw
https://www.youtube.com/watch?v=VEpQvHyAUa0,Gemini Builder: NEW Powerful Autonomous AI Coding Agent Can Build & Design ANYTHING & IS FULLY FREE!,AIエージェント,https://www.youtube.com/channel/UC2WmuBuFq6gL08QYG-JjXKw,UC2WmuBuFq6gL08QYG-JjXKw
https://www.youtube.com/watch?v=eVqMkaYjEps,Gemini CLI Update: GEMINI 3.0 Integration + NEW Mulit AI Coding Agent + NEW Level of Interactivity!,AIエージェント,https://www.youtube.com/channel/UC2WmuBuFq6gL08QYG-JjXKw,UC2WmuBuFq6gL08QYG-JjXKw
https://www.youtube.com/watch?v=UACj1WqXU2Q,Gemini Flows: Google's NEW AI Agent Builder! EASILY Create AI Agents To Do Anything!,AIエージェント,https://www.youtube.com/channel/UC2WmuBuFq6gL08QYG-JjXKw,UC2WmuBuFq6gL08QYG-JjXKw
https://www.youtube.com/watch?v=AMRxbIO04kQ,Gemini Robotics 1.5: Using agentic capabilities,AIエージェント,https://www.youtube.com/channel/UCP7jMXSY2xbc3KCAE0MHQ-A,UCP7jMXSY2xbc3KCAE0MHQ-A
https://www.youtube.com/watch?v=1choivCbZDg,Gemini Super Gems: Google's NEW AI Super Agent! Goodbye N8N! (FULLY FREE AI App Generator),AIエージェント,https://www.youtube.com/channel/UC2WmuBuFq6gL08QYG-JjXKw,UC2WmuBuFq6gL08QYG-JjXKw
https://www.youtube.com/watch?v=OgPxmeIiOeI,Gen AI & Agentic AI Course is now LIVE,AIエージェント,https://www.youtube.com/channel/UCh9nVJoWXmFb7sLApWGcLPQ,UCh9nVJoWXmFb7sLApWGcLPQ
https://www.youtube.com/watch?v=O2gerCxEXvc,Generative AI vs AI agents vs Agentic AI,AIエージェント,https://www.youtube.com/channel/UCh9nVJoWXmFb7sLApWGcLPQ,UCh9nVJoWXmFb7sLApWGcLPQ
https://www.youtube.com/watch?v=ayUZdS3ikqQ,Genspark's Super AI Agent is INSANE,AIエージェント,https://www.youtube.com/channel/UC4JX40jDee_tINbkjycV4Sg,UC4JX40jDee_tINbkjycV4Sg
https://www.youtube.com/watch?v=TV8SyEuSMIA,Give Me 28 Minutes and I'll Completely Change the Way You Build AI Agents,AIエージェント,https://www.youtube.com/channel/UCMwVTLZIRRUyyVrkjDpn4pA,UCMwVTLZIRRUyyVrkjDpn4pA
https://www.youtube.com/watch?v=f5Ihdw32tTw,Google ADK for Beginners: Developing AI Agents with Google,AIエージェント,https://www.youtube.com/channel/UC79Gv3mYp6zKiSwYemEik9A,UC79Gv3mYp6zKiSwYemEik9A
https://www.youtube.com/watch?v=bPtKnDIVEsg,Google Agent Development Kit (ADK): How to deploy Your First Agent to Vertex AI Agent Engine,AIエージェント,https://www.youtube.com/channel/UCEzrs7gK6Nf6t_tadEprzxQ,UCEzrs7gK6Nf6t_tadEprzxQ
https://www.youtube.com/watch?v=6H5gQXzN6vQ,Google Antigravity IDE- The Best Agentic Next Gen IDE,AIエージェント,https://www.youtube.com/channel/UCNU_lfiiWBdtULKOw6X0Dig,UCNU_lfiiWBdtULKOw6X0Dig
https://www.youtube.com/watch?v=U3sTlFaQ1Nw,Google Antigravity: FULLY FREE Agentic Coding Platform! Cursor Killer!,AIエージェント,https://www.youtube.com/channel/UC2WmuBuFq6gL08QYG-JjXKw,UC2WmuBuFq6gL08QYG-JjXKw
https://www.youtube.com/watch?v=z7JijNu5j4w,Google Cloud's CTO on their agentic AI plans | TechCrunch Disrupt 2025,AIエージェント,https://www.youtube.com/channel/UCCjyq_K1Xwfg8Lndy7lKMpA,UCCjyq_K1Xwfg8Lndy7lKMpA
https://www.youtube.com/watch?v=UodANk7TDBY,Google Workspace Studioがでた！ワークフロー型AIエージェントを簡単に作れて、無料で、しかもセキュリティも安心！これは使うしかない！,AIエージェント,https://www.youtube.com/channel/UCpUQnk6MaY4o3NdgJmv10cw,UCpUQnk6MaY4o3NdgJmv10cw
https://www.youtube.com/watch?v=TlbcAphLGSc,"Google, Anthropic, and OpenAI's Guides to AI Agents ALL in 18 Minutes",AIエージェント,https://www.youtube.com/channel/UCMwVTLZIRRUyyVrkjDpn4pA,UCMwVTLZIRRUyyVrkjDpn4pA
https://www.youtube.com/watch?v=7T_TjH6P8CE,"Google’s Gemini 3: AI agents, reasoning and search mode",AIエージェント,https://www.youtube.com/channel/UCKWaEZ-_VweaEx1j62do_vQ,UCKWaEZ-_VweaEx1j62do_vQ
https://www.youtube.com/watch?v=2D72MYTqUbE,Google’s New AI Agent is FREE & More AI Use Cases,AIエージェント,https://www.youtube.com/channel/UCHhYXsLBEVVnbvsq57n1MTQ,UCHhYXsLBEVVnbvsq57n1MTQ
https://www.youtube.com/watch?v=ULszsXDyjMY,How AI Agents Will Transform in 2026 (a16z Big Ideas),AIエージェント,https://www.youtube.com/channel/UC9cn0TuPq4dnbTY-CBsm8XA,UC9cn0TuPq4dnbTY-CBsm8XA
https://www.youtube.com/watch?v=-mldKsBR0UM,How AI Agents and Decision Agents Combine Rules & ML in Automation,AIエージェント,https://www.youtube.com/channel/UCKWaEZ-_VweaEx1j62do_vQ,UCKWaEZ-_VweaEx1j62do_vQ
https://www.youtube.com/watch?v=YjIggq7wzL8,How AI agents are reshaping businesses & team dynamics | Microsoft CMO of AI at Work Jared Spataro,AIエージェント,https://www.youtube.com/channel/UCFtEEv80fQVKkD4h1PF-Xqw,UCFtEEv80fQVKkD4h1PF-Xqw
https://www.youtube.com/watch?v=hfTirr59BO4,How Different Roles Build GenAI Applications #GenAI #AIAgents #LLMs #Flotorch,AIエージェント,https://www.youtube.com/channel/UCzL_0nIe8B4-7ShhVPfJkgw,UCzL_0nIe8B4-7ShhVPfJkgw
https://www.youtube.com/watch?v=HNKlFTd1maM,"How I Sold These 4 AI Agents for $23,000 (as a beginner)",AIエージェント,https://www.youtube.com/channel/UC2ojq-nuP8ceeHqiroeKhBA,UC2ojq-nuP8ceeHqiroeKhBA
https://www.youtube.com/watch?v=g8s6HZZLQsk,How I Won Google's AI Agent Challenge in 5 Hours! [Free Code + 5 AI Dev Strategies],AIエージェント,https://www.youtube.com/channel/UCEzrs7gK6Nf6t_tadEprzxQ,UCEzrs7gK6Nf6t_tadEprzxQ
https://www.youtube.com/watch?v=k-Cj6H6Zwos,How I'd Learn AI Agents FAST if I Had to Start Over (Full Roadmap),AIエージェント,https://www.youtube.com/channel/UCMwVTLZIRRUyyVrkjDpn4pA,UCMwVTLZIRRUyyVrkjDpn4pA
https://www.youtube.com/watch?v=mkACzUDc8Vc,How To Create Upgraded AI Agents with Gram,AIエージェント,https://www.youtube.com/channel/UCJFMlSxcvlZg5yZUYJT0Pug,UCJFMlSxcvlZg5yZUYJT0Pug
https://www.youtube.com/watch?v=47G1aEaNOKU,How To Use ChatKit UI with OpenAI Agent Builder,AIエージェント,https://www.youtube.com/channel/UCJFMlSxcvlZg5yZUYJT0Pug,UCJFMlSxcvlZg5yZUYJT0Pug
https://www.youtube.com/watch?v=S4L8Xz0rV_k,How To Use OpenAI Agent Builder For Advanced Users,AIエージェント,https://www.youtube.com/channel/UCJFMlSxcvlZg5yZUYJT0Pug,UCJFMlSxcvlZg5yZUYJT0Pug
https://www.youtube.com/watch?v=Vas26bqtbQg,How To Use OpenAI Agent Builder with PDFs,AIエージェント,https://www.youtube.com/channel/UCJFMlSxcvlZg5yZUYJT0Pug,UCJFMlSxcvlZg5yZUYJT0Pug
https://www.youtube.com/watch?v=TebGzQRBGgc,How Walmart’s Agentic AI Is Redefining Consumer Confidence and Retail Leadership | VB Transform 2025,AIエージェント,https://www.youtube.com/channel/UCHFEou9pndBIAW5NA200TAQ,UCHFEou9pndBIAW5NA200TAQ
https://www.youtube.com/watch?v=E_ToyA780YU,How to Build AI Agents Capable of Competing in Real-World Settings,AIエージェント,https://www.youtube.com/channel/UCBp3w4DCEC64FZr4k9ROxig,UCBp3w4DCEC64FZr4k9ROxig
https://www.youtube.com/watch?v=WQLzDDNEBGY,How to Build AI Agents Using Python | AI Agents Tutorial | Build AI Agents Using Python |Simplilearn,AIエージェント,https://www.youtube.com/channel/UCsvqVGtbbyHaMoevxPAq9Fg,UCsvqVGtbbyHaMoevxPAq9Fg
https://www.youtube.com/watch?v=OKwDzKY_WN8,How to Build AI Agents in Python,AIエージェント,https://www.youtube.com/channel/UC4JX40jDee_tINbkjycV4Sg,UC4JX40jDee_tINbkjycV4Sg
https://www.youtube.com/watch?v=2qU3SPPojDA,"How to Build a NextJS MVP using v0, Claude, and Cursor",MVP/PMF/リーン,https://www.youtube.com/channel/UCEzrs7gK6Nf6t_tadEprzxQ,UCEzrs7gK6Nf6t_tadEprzxQ
https://www.youtube.com/watch?v=ZqBnen0Om6g,How to Build an AI Agent using AI,AIエージェント,https://www.youtube.com/channel/UC4MZ7zUHb5eAxU75Dc_nqdQ,UC4MZ7zUHb5eAxU75Dc_nqdQ
https://www.youtube.com/watch?v=xNplBYQSUAw,How to Scrape Job Boards with OpenAI Operators (ChatGPT + Sheets),Operator/ブラウザ自動化,https://www.youtube.com/channel/UC4S-xqgZ-czBRCx7I7ztiGw,UC4S-xqgZ-czBRCx7I7ztiGw
https://www.youtube.com/watch?v=bwvfdFWR1RI,"How to Use Agentic AI: LLMs, AI Agents & Prompt Engineering in Action",AIエージェント,https://www.youtube.com/channel/UCKWaEZ-_VweaEx1j62do_vQ,UCKWaEZ-_VweaEx1j62do_vQ
https://www.youtube.com/watch?v=Udx7SLFDsxo,How to build context systems for AI agents,AIエージェント,https://www.youtube.com/channel/UCJS9pqu9BzkAMNTmzNMNhvg,UCJS9pqu9BzkAMNTmzNMNhvg
https://www.youtube.com/watch?v=H-R2gmDkpps,Human in Loop Pattern | OpenAI Agent SDK with Typescript,AIエージェント,https://www.youtube.com/channel/UCf9T51_FmMlfhiGpoes0yFA,UCf9T51_FmMlfhiGpoes0yFA
https://www.youtube.com/watch?v=k_5NcmxWlVg,I Built 3 Lead Gen AI Agents Using ONLY My Words (beginner tutorial),AIエージェント,https://www.youtube.com/channel/UC2ojq-nuP8ceeHqiroeKhBA,UC2ojq-nuP8ceeHqiroeKhBA
https://www.youtube.com/watch?v=HJ9VvIG3Rps,I Built My Claude Code Subagents DREAM TEAM to Create Any AI Agent,AIエージェント,https://www.youtube.com/channel/UCMwVTLZIRRUyyVrkjDpn4pA,UCMwVTLZIRRUyyVrkjDpn4pA
https://www.youtube.com/watch?v=vnzt4lwzbXU,I Built a Hedge Fund Run by AI Agents,AIエージェント,https://www.youtube.com/channel/UCWN3xxRkmTPmbKwht9FuE5A,UCWN3xxRkmTPmbKwht9FuE5A
https://www.youtube.com/watch?v=7UNsK9LoORo,I Built a Photoshop AI Agent in n8n with no code (NanoBanana),AIエージェント,https://www.youtube.com/channel/UC2ojq-nuP8ceeHqiroeKhBA,UC2ojq-nuP8ceeHqiroeKhBA
https://www.youtube.com/watch?v=uAI5NLoojso,I Built a SUPER App to Control All My AI Agents (No Code),AIエージェント,https://www.youtube.com/channel/UCMcoud_ZW7cfxeIugBflSBw,UCMcoud_ZW7cfxeIugBflSBw
https://www.youtube.com/watch?v=-NrAX4OapkQ,"I Built an AI Agent That Made $2,345 in a Day",AIエージェント,https://www.youtube.com/channel/UCWN3xxRkmTPmbKwht9FuE5A,UCWN3xxRkmTPmbKwht9FuE5A
https://www.youtube.com/watch?v=iLtU0wQvCBU,I Built an Entire Marketing Team With One AI Agent (no code with n8n),AIエージェント,https://www.youtube.com/channel/UCMcoud_ZW7cfxeIugBflSBw,UCMcoud_ZW7cfxeIugBflSBw
https://www.youtube.com/watch?v=AYsg5gAMWyo,I Built the Ultimate UGC Content System with AI Agents (free template),AIエージェント,https://www.youtube.com/channel/UC2ojq-nuP8ceeHqiroeKhBA,UC2ojq-nuP8ceeHqiroeKhBA
https://www.youtube.com/watch?v=1jenfjT2PW8,I Just Gave An AI AGENT $1000 to Trade Stocks With This Week...,AIエージェント,https://www.youtube.com/channel/UCR9j1jqqB5Rse69wjUnbYwA,UCR9j1jqqB5Rse69wjUnbYwA
https://www.youtube.com/watch?v=E5y8BlRo6r4,I Let an AI AGENT Trade Stocks for One Week… Should We Be Worried?,AIエージェント,https://www.youtube.com/channel/UCR9j1jqqB5Rse69wjUnbYwA,UCR9j1jqqB5Rse69wjUnbYwA
https://www.youtube.com/watch?v=XeIx4S6YvGo,I Tested OpenAI's AgentKit Against n8n: What You Need to Know,AIエージェント,https://www.youtube.com/channel/UC2ojq-nuP8ceeHqiroeKhBA,UC2ojq-nuP8ceeHqiroeKhBA
https://www.youtube.com/watch?v=vePNTU3T8WY,I built a team of AI Agents with Nano Banana (it’s I-N-S-A-N-E),AIエージェント,https://www.youtube.com/channel/UCPGrgwfbkjTIgPoOh2q1BAg,UCPGrgwfbkjTIgPoOh2q1BAg
https://www.youtube.com/watch?v=bxGE_LXPyAU,I built an AI Agent in 2 hours (and got paid $2600),AIエージェント,https://www.youtube.com/channel/UC2ojq-nuP8ceeHqiroeKhBA,UC2ojq-nuP8ceeHqiroeKhBA
https://www.youtube.com/watch?v=8C6iCpJ9HPo,I built this AI Agent in 2 hours (and got paid $1200),AIエージェント,https://www.youtube.com/channel/UC2ojq-nuP8ceeHqiroeKhBA,UC2ojq-nuP8ceeHqiroeKhBA
https://www.youtube.com/watch?v=GxEC9GgMZ7c,I let Anthropic’s new AI agents control my computer. What happened next is INSANE- Claude for Chrome,AIエージェント,https://www.youtube.com/channel/UCfQNB91qRP_5ILeu_S_bSkg,UCfQNB91qRP_5ILeu_S_bSkg
https://www.youtube.com/watch?v=pFEQYg7uEXU,I tried the tool that gives me and my AI agents infinite memory,AIエージェント,https://www.youtube.com/channel/UCf9T51_FmMlfhiGpoes0yFA,UCf9T51_FmMlfhiGpoes0yFA
https://www.youtube.com/watch?v=d6TEqre0ueU,I used Replit to build an AI agent that manages my life in 13 minutes,AIエージェント,https://www.youtube.com/channel/UCfQNB91qRP_5ILeu_S_bSkg,UCfQNB91qRP_5ILeu_S_bSkg
https://www.youtube.com/watch?v=qgqiSDV8FsQ,INSANE Codex CLI MCP AI Video Automation Workflow,フレームワーク,https://www.youtube.com/channel/UCR9j1jqqB5Rse69wjUnbYwA,UCR9j1jqqB5Rse69wjUnbYwA
https://www.youtube.com/watch?v=Q-qZyaN5sAU,"Industry Roundup #5: AI Agents Hype vs. Reality, Meta’s $15B stake in Scale AI, and the NBA's AI Ad",AIエージェント,https://www.youtube.com/channel/UC79Gv3mYp6zKiSwYemEik9A,UC79Gv3mYp6zKiSwYemEik9A
https://www.youtube.com/watch?v=-ROpc8jXYig,Input Guardrails in AI Agents | OpenAI Agent SDK with Typescript,AIエージェント,https://www.youtube.com/channel/UCf9T51_FmMlfhiGpoes0yFA,UCf9T51_FmMlfhiGpoes0yFA
https://www.youtube.com/watch?v=Awvj4yLYafo,Inside OpenAI's New Agent Development Tools,AIエージェント,https://www.youtube.com/channel/UCUl-s_Vp-Kkk_XVyDylNwLA,UCUl-s_Vp-Kkk_XVyDylNwLA
https://www.youtube.com/watch?v=M_WsbhUIlQ0,"Introducing Atlas, a browser with ChatGPT | AI butlers take care of your internet operations | An...",Operator/ブラウザ自動化,https://www.youtube.com/channel/UCtadcNeydAUCkcUF5t5YNtw,UCtadcNeydAUCkcUF5t5YNtw
https://www.youtube.com/watch?v=Zphax4f6Rls,"Introducing SIMA 2, the next milestone in our research creating general and helpful AI agents.",AIエージェント,https://www.youtube.com/channel/UCP7jMXSY2xbc3KCAE0MHQ-A,UCP7jMXSY2xbc3KCAE0MHQ-A
https://www.youtube.com/watch?v=pecSfrcQZbI,Introducing serverless reinforcement learning: Train reliable AI agents without worrying about GPUs,AIエージェント,https://www.youtube.com/channel/UCBp3w4DCEC64FZr4k9ROxig,UCBp3w4DCEC64FZr4k9ROxig
https://www.youtube.com/watch?v=NrgoZLcY3Kk,Introduction to Vertex AI Agent Engine,AIエージェント,https://www.youtube.com/channel/UCJS9pqu9BzkAMNTmzNMNhvg,UCJS9pqu9BzkAMNTmzNMNhvg
https://www.youtube.com/watch?v=ilaDQLa1Lrk,Is Agentic AI upending the corporate ladder? EY's Global Consulting AI Leader shares what’s coming,AIエージェント,https://www.youtube.com/channel/UCFtEEv80fQVKkD4h1PF-Xqw,UCFtEEv80fQVKkD4h1PF-Xqw
https://www.youtube.com/watch?v=ZeZozy3lsJg,Is this the YEAR or DECADE of AI Agents & Agentic AI?,AIエージェント,https://www.youtube.com/channel/UCKWaEZ-_VweaEx1j62do_vQ,UCKWaEZ-_VweaEx1j62do_vQ
https://www.youtube.com/watch?v=UklCxmEvz2w,LangGraph Tutorial for Beginners: Build Your First AI Agent,AIエージェント,https://www.youtube.com/channel/UC79Gv3mYp6zKiSwYemEik9A,UC79Gv3mYp6zKiSwYemEik9A
https://www.youtube.com/watch?v=i5kwX7jeWL8,Learn 90% of Building AI Agents in 30 Minutes,AIエージェント,https://www.youtube.com/channel/UCMwVTLZIRRUyyVrkjDpn4pA,UCMwVTLZIRRUyyVrkjDpn4pA
https://www.youtube.com/watch?v=dMlFnkIGBpc,"Less Control, More Tools: Why Enterprises Need AI Agents Over Rigid Workflows | VB Transform 2025",AIエージェント,https://www.youtube.com/channel/UCHFEou9pndBIAW5NA200TAQ,UCHFEou9pndBIAW5NA200TAQ
https://www.youtube.com/watch?v=rBJnWMD0Pho,Let Claude handle work in your browser,Operator/ブラウザ自動化,https://www.youtube.com/channel/UCrDwWp7EBBv4NwvScIpBDOA,UCrDwWp7EBBv4NwvScIpBDOA
https://www.youtube.com/watch?v=a0BNjXs5cSc,Long Running AI Agents | On The Edge #4,AIエージェント,https://www.youtube.com/channel/UCR9j1jqqB5Rse69wjUnbYwA,UCR9j1jqqB5Rse69wjUnbYwA
https://www.youtube.com/watch?v=fJgFZRGO9AQ,MCP = Next Big Opportunity? EASIST way to build your own MCP business,フレームワーク,https://www.youtube.com/channel/UCrXSVX9a1mj8l0CMLwKgMVw,UCrXSVX9a1mj8l0CMLwKgMVw
https://www.youtube.com/watch?v=N72-fAI5V9k,Make your AI agents production-ready with Nvidia’s NeMo Toolkit,AIエージェント,https://www.youtube.com/channel/UCcIXc5mJsHVYTZR1maL5l9w,UCcIXc5mJsHVYTZR1maL5l9w
https://www.youtube.com/watch?v=hOqgFNlbrYE,Master Claude Code: Proven Daily Workflows from 3 Technical Founders (Real Examples),起業/新規事業,https://www.youtube.com/channel/UCEMA_xj3YeAI7Z6jsOw3peg,UCEMA_xj3YeAI7Z6jsOw3peg
https://www.youtube.com/watch?v=fuscptIrNEw,Microsoft Copilot「エージェントモード」でExcel作業を半自動化！,AIエージェント,https://www.youtube.com/channel/UCboaqA4fwGpljEKeUjO1iVQ,UCboaqA4fwGpljEKeUjO1iVQ
https://www.youtube.com/watch?v=1v7HPnyaaPU,"Ministry, NIWA Embark On Training For Boat Operators",Operator/ブラウザ自動化,https://www.youtube.com/channel/UCEXGDNclvmg6RW0vipJYsTQ,UCEXGDNclvmg6RW0vipJYsTQ
https://www.youtube.com/watch?v=VkqYmwIIeOg,Mistral Agents API Tutorial: Build Powerful AI Agents,AIエージェント,https://www.youtube.com/channel/UC79Gv3mYp6zKiSwYemEik9A,UC79Gv3mYp6zKiSwYemEik9A
https://www.youtube.com/watch?v=UcLDeH9PaI0,Mistral Devstral 2: NEW Agentic Coding LLM With Vision - Opensource + Powerful (Fully Tested),AIエージェント,https://www.youtube.com/channel/UC2WmuBuFq6gL08QYG-JjXKw,UC2WmuBuFq6gL08QYG-JjXKw
https://www.youtube.com/watch?v=sWH0T4Zez6I,Multi Agent Systems Explained: How AI Agents & LLMs Work Together,AIエージェント,https://www.youtube.com/channel/UCKWaEZ-_VweaEx1j62do_vQ,UCKWaEZ-_VweaEx1j62do_vQ
https://www.youtube.com/watch?v=j91NMeQgy20,Multi-agent System Design - Agent As Tool Pattern in OpenAI Agent SDK with Typescript,AIエージェント,https://www.youtube.com/channel/UCf9T51_FmMlfhiGpoes0yFA,UCf9T51_FmMlfhiGpoes0yFA
https://www.youtube.com/watch?v=OFfwN23hR8U,My Top 20 Lessons from Building 100s of AI Agents (Super Actionable),AIエージェント,https://www.youtube.com/channel/UCMwVTLZIRRUyyVrkjDpn4pA,UCMwVTLZIRRUyyVrkjDpn4pA
https://www.youtube.com/watch?v=NAhKdzo99NI,N8n Complete Guide: Building AI Agents That Make REAL $$ Money,AIエージェント,https://www.youtube.com/channel/UCMcoud_ZW7cfxeIugBflSBw,UCMcoud_ZW7cfxeIugBflSBw
https://www.youtube.com/watch?v=TISRD930_qc,NEW All-In-One AI Agent CAN DO IT ALL! Automate Your Computer and Build Anything! Recursive Agents!,AIエージェント,https://www.youtube.com/channel/UC2WmuBuFq6gL08QYG-JjXKw,UC2WmuBuFq6gL08QYG-JjXKw
https://www.youtube.com/watch?v=C-5FJ6oin-g,NVIDIA Agent Intelligence Toolkitを使用してAIエージェントを開発する方法,AIエージェント,https://www.youtube.com/channel/UCtpJJpXnmHgI6ecoz-KyB5w,UCtpJJpXnmHgI6ecoz-KyB5w
https://www.youtube.com/watch?v=fhl1zyNXHls,NVIDIA NIMを使ってシンプルなAIエージェントを5分で構築する方法,AIエージェント,https://www.youtube.com/channel/UCtpJJpXnmHgI6ecoz-KyB5w,UCtpJJpXnmHgI6ecoz-KyB5w
https://www.youtube.com/watch?v=WFm0nao9hlY,Nathan Fulton - Generative Programming with Mellea: from Agentic - PyData Boston 2025,AIエージェント,https://www.youtube.com/channel/UCOjD18EJYcsBog4IozkF_7w,UCOjD18EJYcsBog4IozkF_7w
https://www.youtube.com/watch?v=q6DU_9CzgXA,"Navigating the Rise of AI Agents | Mat Honan, Will Douglas Heaven & Grace Huckins | LinkedIn Live",AIエージェント,https://www.youtube.com/channel/UCgy4Mf_tlZGqesYNqPNxjPw,UCgy4Mf_tlZGqesYNqPNxjPw
https://www.youtube.com/watch?v=cLteGDv1bgA,NeMoマイクロサービスでエージェント AIをカスタマイズ,AIエージェント,https://www.youtube.com/channel/UCtpJJpXnmHgI6ecoz-KyB5w,UCtpJJpXnmHgI6ecoz-KyB5w
https://www.youtube.com/watch?v=m_dNwtoxqd8,New course: Semantic Caching for AI Agents,AIエージェント,https://www.youtube.com/channel/UCcIXc5mJsHVYTZR1maL5l9w,UCcIXc5mJsHVYTZR1maL5l9w
https://www.youtube.com/watch?v=6TXXMTYQtHk,Notion’s rebuild for agentic AI: How GPT‑5 helped unlock autonomous workflows,AIエージェント,https://www.youtube.com/channel/UCXZCJLdBC09xxGZ6gcdrc6A,UCXZCJLdBC09xxGZ6gcdrc6A
https://www.youtube.com/watch?v=_QfxGZGITGw,"Open Source vs Closed AI: LLMs, Agents & the AI Stack Explained",AIエージェント,https://www.youtube.com/channel/UCKWaEZ-_VweaEx1j62do_vQ,UCKWaEZ-_VweaEx1j62do_vQ
https://www.youtube.com/watch?v=9Hj55Ycg2fA,OpenAI Agent SDK Series - Introduction to brand-new series on building AI Agents,AIエージェント,https://www.youtube.com/channel/UCf9T51_FmMlfhiGpoes0yFA,UCf9T51_FmMlfhiGpoes0yFA
https://www.youtube.com/watch?v=gER0ceSzD7M,OpenAI Agentkit Is Lit- Automate Workflows With Ease,AIエージェント,https://www.youtube.com/channel/UCNU_lfiiWBdtULKOw6X0Dig,UCNU_lfiiWBdtULKOw6X0Dig
https://www.youtube.com/watch?v=mcxeEUC5B4M,OpenAI Founder Reveals The HARSH Truth About AI’s Future,起業/新規事業,https://www.youtube.com/channel/UCOFl0wDeBMSBbK3jNJQHHFg,UCOFl0wDeBMSBbK3jNJQHHFg
https://www.youtube.com/watch?v=NAFaWr4UPFI,OpenAI Just Dropped an AI BROWSER... And It Changes EVERYTHING!,Operator/ブラウザ自動化,https://www.youtube.com/channel/UCOFl0wDeBMSBbK3jNJQHHFg,UCOFl0wDeBMSBbK3jNJQHHFg
https://www.youtube.com/watch?v=lokbsA5VXOk,OpenAI Just Leveled Up n8n AI Agents (here's how it works),AIエージェント,https://www.youtube.com/channel/UC2ojq-nuP8ceeHqiroeKhBA,UC2ojq-nuP8ceeHqiroeKhBA
https://www.youtube.com/watch?v=fg0O0VlVhp8,"OpenAI and Google unite! The strongest alliance ""AAIF"" launches to standardize AI agents | Google...",AIエージェント,https://www.youtube.com/channel/UCtadcNeydAUCkcUF5t5YNtw,UCtadcNeydAUCkcUF5t5YNtw
https://www.youtube.com/watch?v=IHb_TKFAIf0,OpenAI just destroyed 100 startups… yours is next,起業/新規事業,https://www.youtube.com/channel/UCPGrgwfbkjTIgPoOh2q1BAg,UCPGrgwfbkjTIgPoOh2q1BAg
https://www.youtube.com/watch?v=JfM1mr2bCuk,OpenAI's Agent 2.0: Excited or Scared?,AIエージェント,https://www.youtube.com/channel/UCrXSVX9a1mj8l0CMLwKgMVw,UCrXSVX9a1mj8l0CMLwKgMVw
https://www.youtube.com/watch?v=yD-hKFj78g0,OpenAI's Agent Builder,AIエージェント,https://www.youtube.com/channel/UC55ODQSvARtgSyc8ThfiepQ,UC55ODQSvARtgSyc8ThfiepQ
https://www.youtube.com/watch?v=HjdeJupTzzA,OpenAI's AgentBuilder Changes Everything!,AIエージェント,https://www.youtube.com/channel/UCEzrs7gK6Nf6t_tadEprzxQ,UCEzrs7gK6Nf6t_tadEprzxQ
https://www.youtube.com/watch?v=PT1dgVTOGWI,"OpenAI's browser ""ChatGPT Atlas"" is the best! Explaining AI use cases and key points",Operator/ブラウザ自動化,https://www.youtube.com/channel/UCfapRkagDtoQEkGeyD3uERQ,UCfapRkagDtoQEkGeyD3uERQ
