url,title,tags,channel_url,channel_id
https://www.youtube.com/watch?v=9HZVqxGV55g,"OpenAI’s Agent Stack: Shipping Secure, Evaluable Automation at Enterprise Scale | VB Transform 2025",AIエージェント,https://www.youtube.com/channel/UCHFEou9pndBIAW5NA200TAQ,UCHFEou9pndBIAW5NA200TAQ
https://www.youtube.com/watch?v=g93XqSRxcAs,OpenAI’s New Agent Builder is Insane - Full Tutorial,AIエージェント,https://www.youtube.com/channel/UC4JX40jDee_tINbkjycV4Sg,UC4JX40jDee_tINbkjycV4Sg
https://www.youtube.com/watch?v=5uSboan45Zg,OpenAI’s new browser feels familiar…,Operator/ブラウザ自動化,https://www.youtube.com/channel/UCsBjURrPoezykLs9EqgamOA,UCsBjURrPoezykLs9EqgamOA
https://www.youtube.com/watch?v=v4j1_qHLq9s,OpenCode Desktop: BEST AI Coding Agent Ever + FULLY FREE! BYE Gemini CLI & ClaudeCode! (Opensource),AIエージェント,https://www.youtube.com/channel/UC2WmuBuFq6gL08QYG-JjXKw,UC2WmuBuFq6gL08QYG-JjXKw
https://www.youtube.com/watch?v=ipY_e9sldFM,OpenCode: The BEST AI Coding Agent Ever! BYE Gemini CLI & ClaudeCode! (Opensource),AIエージェント,https://www.youtube.com/channel/UC2WmuBuFq6gL08QYG-JjXKw,UC2WmuBuFq6gL08QYG-JjXKw
https://www.youtube.com/watch?v=O5nQKzBb0oc,Operators in R | R for Data Analytics Series,Operator/ブラウザ自動化,https://www.youtube.com/channel/UC7cs8q-gJRlGwj4A8OmCmXg,UC7cs8q-gJRlGwj4A8OmCmXg
https://www.youtube.com/watch?v=YOwDdwtNmPU,Optimizing agentic AI workflows: Metrics-driven evaluation with W&B Weave and NVIDIA - FC London '25,AIエージェント,https://www.youtube.com/channel/UCBp3w4DCEC64FZr4k9ROxig,UCBp3w4DCEC64FZr4k9ROxig
https://www.youtube.com/watch?v=k-tDMvsym-o,Output Guardrails in AI Agents | OpenAI Agent SDK with Typescript,AIエージェント,https://www.youtube.com/channel/UCf9T51_FmMlfhiGpoes0yFA,UCf9T51_FmMlfhiGpoes0yFA
https://www.youtube.com/watch?v=UhhAgc9tvic,Panel 1: Designing Intelligent Agents | Future of Data and AI | Agentic AI Conference,AIエージェント,https://www.youtube.com/channel/UCzL_0nIe8B4-7ShhVPfJkgw,UCzL_0nIe8B4-7ShhVPfJkgw
https://www.youtube.com/watch?v=JdQOPVCcZxo,Panel 2: Architecting Scalable Multi-Agent Workflows | Future of Data and AI | Agentic AI Conference,AIエージェント,https://www.youtube.com/channel/UCzL_0nIe8B4-7ShhVPfJkgw,UCzL_0nIe8B4-7ShhVPfJkgw
https://www.youtube.com/watch?v=O96HGfeMfBo,Phase 1 of AI Agent Series | OpenAI Agent SDK with Typescript,AIエージェント,https://www.youtube.com/channel/UCf9T51_FmMlfhiGpoes0yFA,UCf9T51_FmMlfhiGpoes0yFA
https://www.youtube.com/watch?v=TISROlsLYQg,Physical AI for Smart Cities : Simulate and Build City-Scale AI Agents,AIエージェント,https://www.youtube.com/channel/UCHuiy8bXnmK5nisYHUd1J5g,UCHuiy8bXnmK5nisYHUd1J5g
https://www.youtube.com/watch?v=WKF__cJTxvg,Programming with LLM Agents in 2025,AIエージェント,https://www.youtube.com/channel/UCfzlCWGWYyIQ0aLC5w48gBQ,UCfzlCWGWYyIQ0aLC5w48gBQ
https://www.youtube.com/watch?v=abppwF3MCG0,Projects You Should Build For Gen AI And Agentic AI Roles,AIエージェント,https://www.youtube.com/channel/UCNU_lfiiWBdtULKOw6X0Dig,UCNU_lfiiWBdtULKOw6X0Dig
https://www.youtube.com/watch?v=pPRoAs8xh2o,Put your AI Agents on a VPS… trust me,AIエージェント,https://www.youtube.com/channel/UCPGrgwfbkjTIgPoOh2q1BAg,UCPGrgwfbkjTIgPoOh2q1BAg
https://www.youtube.com/watch?v=-WB0T0XmDrY,PydanticAI: the AI Agent Framework Winner,AIエージェント,https://www.youtube.com/channel/UCVhQ2NnY5Rskt6UjCUkJ_DA,UCVhQ2NnY5Rskt6UjCUkJ_DA
https://www.youtube.com/watch?v=_esGZDtDjPs,Python Operators and Expressions: Arithmetic and Comparison,Operator/ブラウザ自動化,https://www.youtube.com/channel/UCI0vQvr9aFn27yR6Ej6n5UA,UCI0vQvr9aFn27yR6Ej6n5UA
https://www.youtube.com/watch?v=R43Q0nIXa1Q,Python SDK Meets AI Agents: Automating Data Pipelines with LLMs,AIエージェント,https://www.youtube.com/channel/UCKWaEZ-_VweaEx1j62do_vQ,UCKWaEZ-_VweaEx1j62do_vQ
https://www.youtube.com/watch?v=zjwhh2MEa0Q,Python's ternary operator,Operator/ブラウザ自動化,https://www.youtube.com/channel/UCaiL2GDNpLYH6Wokkk1VNcg,UCaiL2GDNpLYH6Wokkk1VNcg
https://www.youtube.com/watch?v=NNGbaiN1L7Y,"RFT Launch, How OpenAI Improves Its Models & the State of AI Agents Today",AIエージェント,https://www.youtube.com/channel/UCUl-s_Vp-Kkk_XVyDylNwLA,UCUl-s_Vp-Kkk_XVyDylNwLA
https://www.youtube.com/watch?v=B7TjQyBCGk4,RIP HUMAN CODERS! CREATE ANY APP With AI AGENTS in 1 PROMPT!,AIエージェント,https://www.youtube.com/channel/UCEAbqW0HFB_UxZoUDO0kJBw,UCEAbqW0HFB_UxZoUDO0kJBw
https://www.youtube.com/watch?v=UjQBgwTcvng,Rogue AI Agents: How AI Observability Builds Autonomous Trust,AIエージェント,https://www.youtube.com/channel/UCKWaEZ-_VweaEx1j62do_vQ,UCKWaEZ-_VweaEx1j62do_vQ
https://www.youtube.com/watch?v=gqaW3MktdsM,Runtime Local-Context Management | OpenAI Agent SDK with Typescript,AIエージェント,https://www.youtube.com/channel/UCf9T51_FmMlfhiGpoes0yFA,UCf9T51_FmMlfhiGpoes0yFA
https://www.youtube.com/watch?v=XgKs0aw8ssg,Scaling LinkedIn’s Hiring Assistant with Multi-Agent LLM Systems | VB Transform 2025,AIエージェント,https://www.youtube.com/channel/UCHFEou9pndBIAW5NA200TAQ,UCHFEou9pndBIAW5NA200TAQ
https://www.youtube.com/watch?v=p8Jx4qvDoSo,Scaling and the Road to Human-Level AI | Anthropic Co-founder Jared Kaplan,起業/新規事業,https://www.youtube.com/channel/UCcefcZRL2oaA_uBNeo5UOWg,UCcefcZRL2oaA_uBNeo5UOWg
https://www.youtube.com/watch?v=bDAEsnVBoRI,Server Conversation and Chat Threads | OpenAI Agent SDK with Typescript,AIエージェント,https://www.youtube.com/channel/UCf9T51_FmMlfhiGpoes0yFA,UCf9T51_FmMlfhiGpoes0yFA
https://www.youtube.com/watch?v=oEgiCgQwi-A,"Shipmas Day 14: Can AI Agents ""Dream"" In a Simulation?",AIエージェント,https://www.youtube.com/channel/UCR9j1jqqB5Rse69wjUnbYwA,UCR9j1jqqB5Rse69wjUnbYwA
https://www.youtube.com/watch?v=Yd9oAPNXxs8,Shipmas Day 8: Image to Code AI Subagents in Claude Code,AIエージェント,https://www.youtube.com/channel/UCR9j1jqqB5Rse69wjUnbYwA,UCR9j1jqqB5Rse69wjUnbYwA
https://www.youtube.com/watch?v=V-0ExE6imTg,Should I Build My AI Agents with n8n or Python?,AIエージェント,https://www.youtube.com/channel/UCMwVTLZIRRUyyVrkjDpn4pA,UCMwVTLZIRRUyyVrkjDpn4pA
https://www.youtube.com/watch?v=QHOTpStej2g,Should You Use OpenAI's New Browser?,Operator/ブラウザ自動化,https://www.youtube.com/channel/UCHhYXsLBEVVnbvsq57n1MTQ,UCHhYXsLBEVVnbvsq57n1MTQ
https://www.youtube.com/watch?v=4LQYWziOg0Q,So You’re Building AI Agents... Now What?,AIエージェント,https://www.youtube.com/channel/UC2ojq-nuP8ceeHqiroeKhBA,UC2ojq-nuP8ceeHqiroeKhBA
https://www.youtube.com/watch?v=a8L0QKI7Kro,Specialized AI Agent Response Teams Defend Against Cyber Threats,AIエージェント,https://www.youtube.com/channel/UCHuiy8bXnmK5nisYHUd1J5g,UCHuiy8bXnmK5nisYHUd1J5g
https://www.youtube.com/watch?v=DL82mGde6wo,State-Of-The-Art Prompting For AI Agents,AIエージェント,https://www.youtube.com/channel/UCcefcZRL2oaA_uBNeo5UOWg,UCcefcZRL2oaA_uBNeo5UOWg
https://www.youtube.com/watch?v=w9-gfaV5vlM,"Stop Selling AI Agents, Sell AI Solutions Instead",AIエージェント,https://www.youtube.com/channel/UC2ojq-nuP8ceeHqiroeKhBA,UC2ojq-nuP8ceeHqiroeKhBA
https://www.youtube.com/watch?v=mrWdrh-6E6g,Streaming LLM Responses | OpenAI Agent SDK with Typescript,AIエージェント,https://www.youtube.com/channel/UCf9T51_FmMlfhiGpoes0yFA,UCf9T51_FmMlfhiGpoes0yFA
https://www.youtube.com/watch?v=2WDJbXsjdhI,Structured AI Outputs with Zod | OpenAI Agent SDK with Typescript,AIエージェント,https://www.youtube.com/channel/UCf9T51_FmMlfhiGpoes0yFA,UCf9T51_FmMlfhiGpoes0yFA
https://www.youtube.com/watch?v=pjF-0dliYhg,Super Special Livestream this Weekend! (LIVE AI Agent Build),AIエージェント,https://www.youtube.com/channel/UCMwVTLZIRRUyyVrkjDpn4pA,UCMwVTLZIRRUyyVrkjDpn4pA
https://www.youtube.com/watch?v=6MCxSJd1ZPY,The 3 AI Agents everyone should have…,AIエージェント,https://www.youtube.com/channel/UCPGrgwfbkjTIgPoOh2q1BAg,UCPGrgwfbkjTIgPoOh2q1BAg
https://www.youtube.com/watch?v=KRjJd-F49Y0,The AI Agent Everyone Will Be Using Soon - Make AI Agent,AIエージェント,https://www.youtube.com/channel/UCwSozl89jl2zUDzQ4jGJD3g,UCwSozl89jl2zUDzQ4jGJD3g
https://www.youtube.com/watch?v=y__qEgqXcF4,The AI Awards 2025 - Best LLM? Biggest Moment in AI? Best Agentic Coder?,AIエージェント,https://www.youtube.com/channel/UCR9j1jqqB5Rse69wjUnbYwA,UCR9j1jqqB5Rse69wjUnbYwA
https://www.youtube.com/watch?v=SsqwRLy0CNQ,The Agentic AI Playbook That a $200B Company Uses,AIエージェント,https://www.youtube.com/channel/UCHFEou9pndBIAW5NA200TAQ,UCHFEou9pndBIAW5NA200TAQ
https://www.youtube.com/watch?v=QB6k_i8RU0k,The Agentic Autonomy Curve is INSANE,AIエージェント,https://www.youtube.com/channel/UCvKRFNawVcuz4b9ihUTApCg,UCvKRFNawVcuz4b9ihUTApCg
https://www.youtube.com/watch?v=URmsLghSQwA,The Best Memory Engine for LLM and AI Agents | Memori,AIエージェント,https://www.youtube.com/channel/UCf9T51_FmMlfhiGpoes0yFA,UCf9T51_FmMlfhiGpoes0yFA
https://www.youtube.com/watch?v=5AfJ0N3MvpA,The Future Of Coding Is With AI Agents,AIエージェント,https://www.youtube.com/channel/UCNU_lfiiWBdtULKOw6X0Dig,UCNU_lfiiWBdtULKOw6X0Dig
https://www.youtube.com/watch?v=BcvjGTxzK40,The Future of AI and SaaS is Agentic Experiences (Here's How to Build Them),AIエージェント,https://www.youtube.com/channel/UCMwVTLZIRRUyyVrkjDpn4pA,UCMwVTLZIRRUyyVrkjDpn4pA
https://www.youtube.com/watch?v=2j26a5dmCnI,The Power of AI Agents and Agentic AI Explained,AIエージェント,https://www.youtube.com/channel/UCKWaEZ-_VweaEx1j62do_vQ,UCKWaEZ-_VweaEx1j62do_vQ
https://www.youtube.com/watch?v=xk6J70MPVkA,The Truth about ChatGPT Agent,AIエージェント,https://www.youtube.com/channel/UCwSozl89jl2zUDzQ4jGJD3g,UCwSozl89jl2zUDzQ4jGJD3g
https://www.youtube.com/watch?v=mNcXue7X8H0,The Ultimate Guide to Local AI and AI Agents (The Future is Here),AIエージェント,https://www.youtube.com/channel/UCMwVTLZIRRUyyVrkjDpn4pA,UCMwVTLZIRRUyyVrkjDpn4pA
https://www.youtube.com/watch?v=fru2vDxy7gs,The cutting edge of AI agents! 8 examples of exceptional AI agents in action,AIエージェント,https://www.youtube.com/channel/UCWMrA-2fEycFnOwqzzdwWuQ,UCWMrA-2fEycFnOwqzzdwWuQ
https://www.youtube.com/watch?v=iF9iV4xponk,The future of agentic coding with Claude Code,AIエージェント,https://www.youtube.com/channel/UCrDwWp7EBBv4NwvScIpBDOA,UCrDwWp7EBBv4NwvScIpBDOA
https://www.youtube.com/watch?v=tHoJAwrs1q8,The latest AI agent! Claude Code from Anthropic is so amazing that I'll explain it here,AIエージェント,https://www.youtube.com/channel/UCZQVTC3uLCyuJUOcRlguazA,UCZQVTC3uLCyuJUOcRlguazA
https://www.youtube.com/watch?v=LVt1WpjSgBU,"The latest from OpenAI! Explaining the announcements at DevDay 2025 (Agent Builder, Apps SDK, etc.)",AIエージェント,https://www.youtube.com/channel/UCZQVTC3uLCyuJUOcRlguazA,UCZQVTC3uLCyuJUOcRlguazA
https://www.youtube.com/watch?v=2z0WM3CWgX4,The pros and cons of using AI agents as early employees | TechCrunch Disrupt 2025,AIエージェント,https://www.youtube.com/channel/UCCjyq_K1Xwfg8Lndy7lKMpA,UCCjyq_K1Xwfg8Lndy7lKMpA
https://www.youtube.com/watch?v=Y4B4QuDxCos,This AI Agent Just Wrote a Book in 60 Seconds,AIエージェント,https://www.youtube.com/channel/UChpleBmo18P08aKCIgti38g,UChpleBmo18P08aKCIgti38g
https://www.youtube.com/watch?v=2o0mgt5mdbE,This AI Agent built an entire Workflow with just one PROMPT | Replit Agent 3,AIエージェント,https://www.youtube.com/channel/UCf9T51_FmMlfhiGpoes0yFA,UCf9T51_FmMlfhiGpoes0yFA
https://www.youtube.com/watch?v=knT3kN4EpOo,This AI agent runs on Cloud Run + NVIDIA GPUs,AIエージェント,https://www.youtube.com/channel/UCJS9pqu9BzkAMNTmzNMNhvg,UCJS9pqu9BzkAMNTmzNMNhvg
https://www.youtube.com/watch?v=kG69Ry0kXXM,This Claude Code for Web workflow will change how you vibe code forever,Operator/ブラウザ自動化,https://www.youtube.com/channel/UCfQNB91qRP_5ILeu_S_bSkg,UCfQNB91qRP_5ILeu_S_bSkg
https://www.youtube.com/watch?v=CwvzZgKG_JI,This Is How You Actually Build an AI Agent (Step-by-Step),AIエージェント,https://www.youtube.com/channel/UCwSozl89jl2zUDzQ4jGJD3g,UCwSozl89jl2zUDzQ4jGJD3g
https://www.youtube.com/watch?v=Pek0KQQmELw,This New AI Agent Can Create Anything - Hailuo AI Agent,AIエージェント,https://www.youtube.com/channel/UCwSozl89jl2zUDzQ4jGJD3g,UCwSozl89jl2zUDzQ4jGJD3g
https://www.youtube.com/watch?v=oAoigBWLZgE,Those MCP totally 10x my Cursor workflow…,フレームワーク,https://www.youtube.com/channel/UCrXSVX9a1mj8l0CMLwKgMVw,UCrXSVX9a1mj8l0CMLwKgMVw
https://www.youtube.com/watch?v=2kQ6fF2wIw8,Tool Calling in AI Agents | OpenAI Agent SDK with Typescript,AIエージェント,https://www.youtube.com/channel/UCf9T51_FmMlfhiGpoes0yFA,UCf9T51_FmMlfhiGpoes0yFA
https://www.youtube.com/watch?v=lx813D-mb7Y,Tool-space Interference: An emerging problem for LLM agents,AIエージェント,https://www.youtube.com/channel/UCCb9_Kn8F_Opb3UCGm-lILQ,UCCb9_Kn8F_Opb3UCGm-lILQ
https://www.youtube.com/watch?v=HM0i1-0Xr0c,"Top 20 AI News Topics: Agent Skills, New Gem, GPT-Image 1.5, Gemini 3 Flash, OpenAI Over 1 Millio...",AIエージェント,https://www.youtube.com/channel/UCpUQnk6MaY4o3NdgJmv10cw,UCpUQnk6MaY4o3NdgJmv10cw
https://www.youtube.com/watch?v=5SbLJNVuqR0,Tutorial: Agentic AI Workflow Deployment with Ejento | Future of Data and AI | Agentic AI Conference,AIエージェント,https://www.youtube.com/channel/UCzL_0nIe8B4-7ShhVPfJkgw,UCzL_0nIe8B4-7ShhVPfJkgw
https://www.youtube.com/watch?v=1eNoNadJfHE,Tutorial: Agentic Document Extraction with LandingAI | Future of Data and AI | Agentic AI Conference,AIエージェント,https://www.youtube.com/channel/UCzL_0nIe8B4-7ShhVPfJkgw,UCzL_0nIe8B4-7ShhVPfJkgw
https://www.youtube.com/watch?v=Izm3TrJpwrY,Tutorial: Agentic Research Assistants with Reka AI | Future of Data and AI | Agentic AI Conference,AIエージェント,https://www.youtube.com/channel/UCzL_0nIe8B4-7ShhVPfJkgw,UCzL_0nIe8B4-7ShhVPfJkgw
https://www.youtube.com/watch?v=SB7QtiDfKPQ,Tutorial: Build Vision-Enabled Agents with Deepset | Future of Data and AI | Agentic AI Conference,AIエージェント,https://www.youtube.com/channel/UCzL_0nIe8B4-7ShhVPfJkgw,UCzL_0nIe8B4-7ShhVPfJkgw
https://www.youtube.com/watch?v=bbKn3z2tjK0,Tutorial: Building Agentic Workflows with FloTorch | Future of Data and AI | Agentic AI Conference,AIエージェント,https://www.youtube.com/channel/UCzL_0nIe8B4-7ShhVPfJkgw,UCzL_0nIe8B4-7ShhVPfJkgw
https://www.youtube.com/watch?v=m8ohXrzqoO0,Tutorial: Building Event-Driven Agents with Docker | Future of Data and AI | Agentic AI Conference,AIエージェント,https://www.youtube.com/channel/UCzL_0nIe8B4-7ShhVPfJkgw,UCzL_0nIe8B4-7ShhVPfJkgw
https://www.youtube.com/watch?v=jVazhPkg-8Q,Tutorial: Self-Improving Agentic System on AWS | Future of Data and AI | Agentic AI Conference,AIエージェント,https://www.youtube.com/channel/UCzL_0nIe8B4-7ShhVPfJkgw,UCzL_0nIe8B4-7ShhVPfJkgw
https://www.youtube.com/watch?v=_U-ur9uOrac,Tutorial: Vertical AI Agents | Future of Data and AI | Agentic AI Conference,AIエージェント,https://www.youtube.com/channel/UCzL_0nIe8B4-7ShhVPfJkgw,UCzL_0nIe8B4-7ShhVPfJkgw
https://www.youtube.com/watch?v=7LWTZqksmSg,Unlock AI Agent real power?! Long term memory & Self improving,AIエージェント,https://www.youtube.com/channel/UCrXSVX9a1mj8l0CMLwKgMVw,UCrXSVX9a1mj8l0CMLwKgMVw
https://www.youtube.com/watch?v=NoVMk_P6fgY,Unpacking AI Agent Hype vs. Reality with Arvind Narayanan,AIエージェント,https://www.youtube.com/channel/UCUl-s_Vp-Kkk_XVyDylNwLA,UCUl-s_Vp-Kkk_XVyDylNwLA
https://www.youtube.com/watch?v=bhqLatL1Km8,Verdent: NEW Agentic Coder IS POWERFUL! Can Build ANYTHING! (Sub Agents + SOTA),AIエージェント,https://www.youtube.com/channel/UC2WmuBuFq6gL08QYG-JjXKw,UC2WmuBuFq6gL08QYG-JjXKw
https://www.youtube.com/watch?v=on623d5EfPw,Watch ChatGPT Build a Finance Startup,起業/新規事業,https://www.youtube.com/channel/UCWN3xxRkmTPmbKwht9FuE5A,UCWN3xxRkmTPmbKwht9FuE5A
https://www.youtube.com/watch?v=hL2hLFUwuqQ,Watch ChatGPT Build an AI Startup,起業/新規事業,https://www.youtube.com/channel/UCWN3xxRkmTPmbKwht9FuE5A,UCWN3xxRkmTPmbKwht9FuE5A
https://www.youtube.com/watch?v=rLxJzeRGzV8,What 30K JPMorgan AI Agents Taught Me,AIエージェント,https://www.youtube.com/channel/UCHFEou9pndBIAW5NA200TAQ,UCHFEou9pndBIAW5NA200TAQ
https://www.youtube.com/watch?v=qsO5jVrzoas,What are AI Agents. Let's build one,AIエージェント,https://www.youtube.com/channel/UCXgGY0wkgOzynnHvSEVmE3A,UCXgGY0wkgOzynnHvSEVmE3A
https://www.youtube.com/watch?v=RoIVDn5RQ4E,"What are the highly anticipated Agent Skills? You can give your AI agents ""job recipes + tools""! ...",AIエージェント,https://www.youtube.com/channel/UCpUQnk6MaY4o3NdgJmv10cw,UCpUQnk6MaY4o3NdgJmv10cw
https://www.youtube.com/watch?v=P6y0gr-W2-k,"What has PMF Today, Google is Cooking & GPT Wrappers are Winning | With Latent Space",MVP/PMF/リーン,https://www.youtube.com/channel/UCUl-s_Vp-Kkk_XVyDylNwLA,UCUl-s_Vp-Kkk_XVyDylNwLA
https://www.youtube.com/watch?v=15_pppse4fY,What is Agentic AI and How Does it Work?,AIエージェント,https://www.youtube.com/channel/UCh9nVJoWXmFb7sLApWGcLPQ,UCh9nVJoWXmFb7sLApWGcLPQ
https://www.youtube.com/watch?v=2VroIM26s84,What startups want from OpenAI | Equity Podcast,起業/新規事業,https://www.youtube.com/channel/UCCjyq_K1Xwfg8Lndy7lKMpA,UCCjyq_K1Xwfg8Lndy7lKMpA
https://www.youtube.com/watch?v=ZpC1FZ2yAFA,Why Smart Routing Matters: Reduce LLM Cost & Latency with FloTorch #flotorch #agenticai #genai,AIエージェント,https://www.youtube.com/channel/UCzL_0nIe8B4-7ShhVPfJkgw,UCzL_0nIe8B4-7ShhVPfJkgw
https://www.youtube.com/watch?v=F1I9JN0z0w0,Why is Everyone Missing This with AI Agents?! (Memory + Tools that Scale),AIエージェント,https://www.youtube.com/channel/UCMwVTLZIRRUyyVrkjDpn4pA,UCMwVTLZIRRUyyVrkjDpn4pA
https://www.youtube.com/watch?v=cNEs710IRsQ,Workshop: Agentic AI for Semantic Search | Future of Data and AI | Agentic AI Conference,AIエージェント,https://www.youtube.com/channel/UCzL_0nIe8B4-7ShhVPfJkgw,UCzL_0nIe8B4-7ShhVPfJkgw
https://www.youtube.com/watch?v=_UojjKvC_s4,Workshop: Agentic Document Extraction with LandingAI | Future of Data and AI | Agentic AI Conference,AIエージェント,https://www.youtube.com/channel/UCzL_0nIe8B4-7ShhVPfJkgw,UCzL_0nIe8B4-7ShhVPfJkgw
https://www.youtube.com/watch?v=qmu5ncGuUVM,Workshop: Building AI Agents with Weaviate | Future of Data and AI | Agentic AI Conference,AIエージェント,https://www.youtube.com/channel/UCzL_0nIe8B4-7ShhVPfJkgw,UCzL_0nIe8B4-7ShhVPfJkgw
https://www.youtube.com/watch?v=nMKS-QXjqo8,"Workshop: Building Smarter Agents, Faster with Arize | Future of Data and AI | Agentic AI Conference",AIエージェント,https://www.youtube.com/channel/UCzL_0nIe8B4-7ShhVPfJkgw,UCzL_0nIe8B4-7ShhVPfJkgw
https://www.youtube.com/watch?v=7fTuBQTR7rg,Workshop: Transformer Models with @SerranoAcademy | Future of Data and AI | Agentic AI Conference,AIエージェント,https://www.youtube.com/channel/UCzL_0nIe8B4-7ShhVPfJkgw,UCzL_0nIe8B4-7ShhVPfJkgw
https://www.youtube.com/watch?v=xRmzLHnssXE,You Won’t Believe What the Notion AI Agent Can Do Now,AIエージェント,https://www.youtube.com/channel/UCwSozl89jl2zUDzQ4jGJD3g,UCwSozl89jl2zUDzQ4jGJD3g
https://www.youtube.com/watch?v=-Csoj96rIrs,"[10x Productivity] What is AIX? | The ""AI Agent Revolution"" that can create the workforce of 10,0...",AIエージェント,https://www.youtube.com/channel/UCGlgXjYVoHLD86TQQ799WIw,UCGlgXjYVoHLD86TQQ799WIw
https://www.youtube.com/watch?v=Z6gluxYKQcs,[AI Autonomous Development] Building an Engineering Team with Claude Code and Having It Write Cod...,AIエージェント,https://www.youtube.com/channel/UCNTxclE0N4qsUuirssL_D8w,UCNTxclE0N4qsUuirssL_D8w
https://www.youtube.com/watch?v=SUvuVmB6fRg,[AI News] Runway Gen-4.5 surpasses Google and OpenAI to take first place in benchmarks!,Operator/ブラウザ自動化,https://www.youtube.com/channel/UCswNRnSQstgW_ePcJWx4zXQ,UCswNRnSQstgW_ePcJWx4zXQ
https://www.youtube.com/watch?v=CZmx2iF8hoM,[AI Security] Basics of preventing information leaks and AI agent hijacking,AIエージェント,https://www.youtube.com/channel/UC9AuyS7U4PxeDSNMJ2srarA,UC9AuyS7U4PxeDSNMJ2srarA
https://www.youtube.com/watch?v=slN-Ms8rdxw,[Absolutely the best] ClaudeCode now has a new feature called Rules! Subagent has also been impro...,AIエージェント,https://www.youtube.com/channel/UCvHpETRVi1tXeRJoYiXHJqw,UCvHpETRVi1tXeRJoYiXHJqw
https://www.youtube.com/watch?v=3-K1paNSbm4,"[Amazing Feature] Claude Code's unique browser tool has arrived! It's super useful, so I'll expla...",Operator/ブラウザ自動化,https://www.youtube.com/channel/UCvHpETRVi1tXeRJoYiXHJqw,UCvHpETRVi1tXeRJoYiXHJqw
https://www.youtube.com/watch?v=uRa0_Oq2U5Y,"[Boosting Japan] What is omakase.ai, the world's number one AI product that surpasses Gemini? - M...",Operator/ブラウザ自動化,https://www.youtube.com/channel/UCtadcNeydAUCkcUF5t5YNtw,UCtadcNeydAUCkcUF5t5YNtw
https://www.youtube.com/watch?v=i8xz9HIQnQo,"[ChatGPT Unrivaled] OpenAI releases Dify-like workflow tool ""Agent Builder."" It also enables exte...",AIエージェント,https://www.youtube.com/channel/UC9buL3Iph_f7AZxdzmiBL8Q,UC9buL3Iph_f7AZxdzmiBL8Q
https://www.youtube.com/watch?v=zC-_g1UtEP0,[Complete Comparison] A thorough review of 14 AI agents in development! How good are Cursor and A...,AIエージェント,https://www.youtube.com/channel/UCvHpETRVi1tXeRJoYiXHJqw,UCvHpETRVi1tXeRJoYiXHJqw
https://www.youtube.com/watch?v=hLJkuDle4OE,"[Create PowerPoint files in an instant] Claude's new ""File Generation"" feature surpasses ChatGPT ...",Operator/ブラウザ自動化,https://www.youtube.com/channel/UC9buL3Iph_f7AZxdzmiBL8Q,UC9buL3Iph_f7AZxdzmiBL8Q
https://www.youtube.com/watch?v=JJxYFfE-5Y8,"[Fall 2025 Update] Top 5 Free AI Agents! ~An era where AI automatically creates slides, Japanese ...",AIエージェント,https://www.youtube.com/channel/UCXo1SsIDZ_dke2Nr1r3qk6w,UCXo1SsIDZ_dke2Nr1r3qk6w
https://www.youtube.com/watch?v=lhr-drVknW0,[Finally surpassing humans] Gemini 3 fully automates document creation and development! The power...,Operator/ブラウザ自動化,https://www.youtube.com/channel/UC9buL3Iph_f7AZxdzmiBL8Q,UC9buL3Iph_f7AZxdzmiBL8Q
https://www.youtube.com/watch?v=DZGeiKiaoww,[Great Deal!!] Life-changing! 9 Free AI Tools - Carefully selected generative AI tools/AI agents ...,AIエージェント,https://www.youtube.com/channel/UCpUQnk6MaY4o3NdgJmv10cw,UCpUQnk6MaY4o3NdgJmv10cw
https://www.youtube.com/watch?v=T5ry8nlFAkg,"[Growth Surpasses ChatGPT] Complete Guide to Google Gemini, Updated December 2025! This single vi...",Operator/ブラウザ自動化,https://www.youtube.com/channel/UCXo1SsIDZ_dke2Nr1r3qk6w,UCXo1SsIDZ_dke2Nr1r3qk6w
https://www.youtube.com/watch?v=btqoPyFjqTI,"[It's finally here!!] The most powerful AI browser, ChatGPT ""Atlas,"" is here! A thorough explanat...",Operator/ブラウザ自動化,https://www.youtube.com/channel/UChxtIA33ty53Hh4MmkXNASg,UChxtIA33ty53Hh4MmkXNASg
https://www.youtube.com/watch?v=FI-YJOxe3Xw,"[New Feature] OpenAI releases ChatGPT-enabled browser ""Atlas."" AI understands pages and enables s...",Operator/ブラウザ自動化,https://www.youtube.com/channel/UC9buL3Iph_f7AZxdzmiBL8Q,UC9buL3Iph_f7AZxdzmiBL8Q
https://www.youtube.com/watch?v=fsKp0WBFqGU,"[Physics AI Revolution] Google's latest robot finally features AI agent functionality. ""Google's ...",AIエージェント,https://www.youtube.com/channel/UCYrbht7gNUX3xlbGRXjhrnQ,UCYrbht7gNUX3xlbGRXjhrnQ
https://www.youtube.com/watch?v=fsZ4mUTZZ7E,"[Recommended] We recommend the new browser AI ""Claude for Chrome""! Easy to install and convenient...",Operator/ブラウザ自動化,https://www.youtube.com/channel/UCvHpETRVi1tXeRJoYiXHJqw,UCvHpETRVi1tXeRJoYiXHJqw
https://www.youtube.com/watch?v=xyvyYDW1K6A,"[Surpassing ChatGPT] Google releases the most powerful image generation AI, ""Nano Banana Pro."" It...",Operator/ブラウザ自動化,https://www.youtube.com/channel/UC9buL3Iph_f7AZxdzmiBL8Q,UC9buL3Iph_f7AZxdzmiBL8Q
https://www.youtube.com/watch?v=NuJzg3jTleI,[Weekly Latest AI Tools & News] Sora announces multiple new features / ChatGPT-powered AI browser...,Operator/ブラウザ自動化,https://www.youtube.com/channel/UCXo1SsIDZ_dke2Nr1r3qk6w,UCXo1SsIDZ_dke2Nr1r3qk6w
https://www.youtube.com/watch?v=oWdJMJp2HgM,n8n JUST Leveled Up AI Agents With Guardrails: Here's How It Works,AIエージェント,https://www.youtube.com/channel/UC2ojq-nuP8ceeHqiroeKhBA,UC2ojq-nuP8ceeHqiroeKhBA
https://www.youtube.com/watch?v=5N763y3HNRU,【1本で全てわかる】パワポはもう不要？Gensparkの使い方・初心者入門講座（AIスライド/AIシート/スーパーエージェント）,AIエージェント,https://www.youtube.com/channel/UCgwv7JsLDvGTtRdFI4TVRQw,UCgwv7JsLDvGTtRdFI4TVRQw
https://www.youtube.com/watch?v=y_N5oaBOdcs,【1本で全て分かる】Genspark超え？最新AIエージェント「Skywork」の使い方・初心者入門講座。（スーパーエージェント/ドキュメント/スプレッドシート）,AIエージェント,https://www.youtube.com/channel/UCgwv7JsLDvGTtRdFI4TVRQw,UCgwv7JsLDvGTtRdFI4TVRQw
https://www.youtube.com/watch?v=QvEdfnr4ge4,【1本で全て分かる】初心者でも簡単に自動化！究極のAIエージェント「n8n」の使い方・入門講座。（活用事例：ChatGPT/Google/Slack連携）,AIエージェント,https://www.youtube.com/channel/UCgwv7JsLDvGTtRdFI4TVRQw,UCgwv7JsLDvGTtRdFI4TVRQw
https://www.youtube.com/watch?v=XKBQGe7Z7is,【7月編】生成AI最新ニュース10選【Gemini CLI、o3-Pro、Deep Research、ChatGPT Agentなど】,AIエージェント,https://www.youtube.com/channel/UCWMrA-2fEycFnOwqzzdwWuQ,UCWMrA-2fEycFnOwqzzdwWuQ
